"source","date","assertionType","evidenceType","exactText","modality","statementType","drug1Lab","drug1Type","drug1Role","dose1","drug2Lab","drug2Type","drug2Role","dose2","objectRegimens","objectFormulation","objectDuration","preciptRegimens","preciptFormulation","preciptDuration","numOfParticipants","auc","aucType","aucDirection","cl","clType","clDirection","cmax","cmaxType","cmaxDirection","t12","t12Type","t12Direction"
"http://dbmi-icode-01.dbmi.pitt.edu:80/DDI-labels/51ff7db5-aaf9-4c3c-86e6-958ebf16b60f.html","2015-11-29 12:22:19 -0800","drug-drug-interaction","evidence-supports","There have been reports of increased blood concentrations of cyclosporine and tacrolimus into toxic ranges when patients received these drugs concomitantly with nefazodone. Both cyclosporine and tacrolimus are substrates of CYP3A4, and nefazodone is known to inhibit this enzyme. If either cyclosporine or tacrolimus is administered with nefazodone, blood concentrations of the immunosuppressive agent should be monitored and dosage adjusted accordingly.","ncit:positive","ncit:Qualitative","tacrolimus","http://dbmi-icode-01.dbmi.pitt.edu:2020/vocab/resource/active-ingredient","dikbD2R:object-drug-of-interaction","nodeID://b36470","nefazodone","http://dbmi-icode-01.dbmi.pitt.edu:2020/vocab/resource/active-ingredient","dikbD2R:precipitant-drug-of-interaction",,,,,,,,,,,,,,,,,,,,
"http://dbmi-icode-01.dbmi.pitt.edu:80/DDI-labels/4e1e5249-1cb7-4cc2-ad5a-cdeeee2f494f.html","2016-02-16 16:34:30 -0700","drug-drug-interaction","evidence-supports","Quetiapine exposure is increased by the prototype CYP3A4 inhibitors (e.g., ketoconazole, itraconazole, indinavir, ritonavir, nefazodone, etc.)","ncit:positive","ncit:Qualitative","itraconazole","http://dbmi-icode-01.dbmi.pitt.edu:2020/vocab/resource/active-ingredient","dikbD2R:precipitant-drug-of-interaction",,"Quetiapine","http://dbmi-icode-01.dbmi.pitt.edu:2020/vocab/resource/active-ingredient","dikbD2R:object-drug-of-interaction","nodeID://b31719",,,,,,,,,,,,,,,,,,,
"http://dbmi-icode-01.dbmi.pitt.edu:80/DDI-labels/4e1e5249-1cb7-4cc2-ad5a-cdeeee2f494f.html","2016-02-16 16:45:41 -0700","drug-drug-interaction","evidence-supports","Quetiapine exposure is increased by the prototype CYP3A4 inhibitors (e.g., ketoconazole, itraconazole, indinavir, ritonavir, nefazodone, etc.). and decreased by the prototype CYP3A4 inducers (e..g, phenytoin, carbamazepine, rifampin, avasimibe, St. John’s wort etc.).","ncit:positive","ncit:Qualitative","Quetiapine","http://dbmi-icode-01.dbmi.pitt.edu:2020/vocab/resource/active-ingredient","dikbD2R:object-drug-of-interaction","nodeID://b36626","avasimibe","http://dbmi-icode-01.dbmi.pitt.edu:2020/vocab/resource/active-ingredient","dikbD2R:precipitant-drug-of-interaction",,,,,,,,,,,,,,,,,,,,
"http://dbmi-icode-01.dbmi.pitt.edu:80/DDI-labels/5f0c6f5f-b906-4c8f-8580-3939a476a1c1.html","2016-01-11 10:43:26 -0700","drug-drug-interaction","evidence-supports","Concomitant treatment with CLOZARIL and CYP2D6 or CYP3A4 inhibitors (e.g., cimetidine, escitalopram, erythromycin, paroxetine, bupropion, fluoxetine, quinidine, duloxetine, terbinafine, or sertraline) can increase clozapine levels and lead to adverse reactions [see Clinical Pharmacology (12.3)]. Use caution and monitor patients closely when using such inhibitors. Consider reducing the CLOZARIL dose [see Dosage and Administration (2.6)]","ncit:positive","ncit:Qualitative","sertraline","http://dbmi-icode-01.dbmi.pitt.edu:2020/vocab/resource/active-ingredient","dikbD2R:precipitant-drug-of-interaction",,"clozapine","http://dbmi-icode-01.dbmi.pitt.edu:2020/vocab/resource/active-ingredient","dikbD2R:object-drug-of-interaction","nodeID://b36400",,,,,,,,,,,,,,,,,,,
"http://dbmi-icode-01.dbmi.pitt.edu:80/DDI-labels/5f0c6f5f-b906-4c8f-8580-3939a476a1c1.html","2016-01-11 10:41:56 -0700","drug-drug-interaction","evidence-supports","Concomitant treatment with CLOZARIL and CYP2D6 or CYP3A4 inhibitors (e.g., cimetidine, escitalopram, erythromycin, paroxetine, bupropion, fluoxetine, quinidine, duloxetine, terbinafine, or sertraline) can increase clozapine levels and lead to adverse reactions [see Clinical Pharmacology (12.3)]. Use caution and monitor patients closely when using such inhibitors. Consider reducing the CLOZARIL dose [see Dosage and Administration (2.6)]","ncit:positive","ncit:Qualitative","clozapine","http://dbmi-icode-01.dbmi.pitt.edu:2020/vocab/resource/active-ingredient","dikbD2R:object-drug-of-interaction","nodeID://b35878","fluoxetine","http://dbmi-icode-01.dbmi.pitt.edu:2020/vocab/resource/active-ingredient","dikbD2R:precipitant-drug-of-interaction",,,,,,,,,,,,,,,,,,,,
"http://dbmi-icode-01.dbmi.pitt.edu:80/DDI-labels/4e1e5249-1cb7-4cc2-ad5a-cdeeee2f494f.html","2016-02-16 16:50:39 -0700","drug-drug-interaction","evidence-supports","Coadministration of ketoconazole, a potent inhibitor of cytochrome CYP3A4, resulted in significant increase in quetiapine exposure.","ncit:positive","ncit:Qualitative","quetiapine","http://dbmi-icode-01.dbmi.pitt.edu:2020/vocab/resource/active-ingredient","dikbD2R:object-drug-of-interaction","nodeID://b36167","ketoconazole","http://dbmi-icode-01.dbmi.pitt.edu:2020/vocab/resource/active-ingredient","dikbD2R:precipitant-drug-of-interaction",,,,,,,,,,,,,,,,,,,,
"http://dbmi-icode-01.dbmi.pitt.edu:80/DDI-labels/51ff7db5-aaf9-4c3c-86e6-958ebf16b60f.html","2015-11-29 11:47:05 -0800","DDI-clinical-trial","evidence-challenges","Propranolol – The coadministration of nefazodone (200 mg BID) and propranolol (40 mg BID) for 5.5 days to healthy male volunteers (n = 18), including 3 poor and 15 extensive CYP2D6 metabolizers, resulted in 30% and 14% reductions in Cmax and AUC of propranolol, respectively, and a 14% reduction in Cmax for the metabolite, 4-hydroxypropranolol. The kinetics of nefazodone, hydroxynefazodone, and triazole-dione were not affected by coadministration of propranolol. However, Cmax, Cmin, and AUC of m-chlorophenylpiperazine were increased by 23%, 54%, and 28%, respectively. No change in initial dose of either drug is necessary and dose adjustments should be made on the basis of clinical response.","ncit:negative","ncit:quantitative","hydroxynefazodone","http://dbmi-icode-01.dbmi.pitt.edu:2020/vocab/resource/metabolite","dikbD2R:object-drug-of-interaction","200","propranolol","http://dbmi-icode-01.dbmi.pitt.edu:2020/vocab/resource/active-ingredient","dikbD2R:precipitant-drug-of-interaction","40","BID","Oral","5.5","BID","Oral","5.5","18","UNK","UNK","UNK","UNK","UNK","UNK","UNK","UNK","UNK","UNK","UNK","UNK"
"http://dbmi-icode-01.dbmi.pitt.edu:80/DDI-labels/51ff7db5-aaf9-4c3c-86e6-958ebf16b60f.html","2015-11-27 14:33:34 -0800","DDI-clinical-trial","evidence-supports"," When fluoxetine (20 mg QD) and nefazodone (200 mg BID) were administered at steady state there were no changes in the pharmacokinetic parameters for fluoxetine or its metabolite, norfluoxetine. Similarly, there were no changes in the pharmacokinetic parameters of nefazodone or HO-NEF; however, the mean AUC levels of the nefazodone metabolites mCPP and triazole-dione increased by 3 to 6 fold and 1.3 fold, respectively","ncit:positive","ncit:quantitative","mCPP","http://dbmi-icode-01.dbmi.pitt.edu:2020/vocab/resource/metabolite","dikbD2R:object-drug-of-interaction","200","fluoxetine","http://dbmi-icode-01.dbmi.pitt.edu:2020/vocab/resource/active-ingredient","dikbD2R:precipitant-drug-of-interaction","20","BID","Oral","UNK","QD","Oral","UNK","UNK","3 to 6","Percent","Increase","UNK","UNK","UNK","UNK","UNK","UNK","UNK","UNK","UNK"
"http://dbmi-icode-01.dbmi.pitt.edu:80/DDI-labels/a971ea18-40cf-4a01-b696-180ccc3fddb5.html","2016-02-29 14:04:47 -0700","drug-drug-interaction","evidence-supports","Concomitant administration of propranolol with phenothiazines results in increased plasma levels of both drugs.","ncit:positive","ncit:Qualitative","propranolol","http://dbmi-icode-01.dbmi.pitt.edu:2020/vocab/resource/active-ingredient","dikbD2R:precipitant-drug-of-interaction",,"phenothiazines","http://dbmi-icode-01.dbmi.pitt.edu:2020/vocab/resource/active-ingredient","dikbD2R:object-drug-of-interaction","nodeID://b36277",,,,,,,,,,,,,,,,,,,
"http://dbmi-icode-01.dbmi.pitt.edu:80/DDI-labels/d5051fbc-846b-4946-82df-341fb1216341.html","2016-02-16 12:34:19 -0700","DDI-clinical-trial","evidence-supports","Fluvoxamine, a CYP1A2 inhibitor, decreases the clearance of olanzapine. This results in a mean increase in olanzapine Cmax following fluvoxamine of 54% in female nonsmokers and 77% in male smokers. The mean increase in olanzapine AUC is 52% and 108%, respectively.","ncit:positive","ncit:quantitative","fluvoxamine","http://dbmi-icode-01.dbmi.pitt.edu:2020/vocab/resource/active-ingredient","dikbD2R:precipitant-drug-of-interaction","UNK","olanzapine","http://dbmi-icode-01.dbmi.pitt.edu:2020/vocab/resource/active-ingredient","dikbD2R:object-drug-of-interaction","UNK","UNK","Oral","UNK","UNK","Oral","UNK","UNK","52-108","Percent","Increase","UNK","UNK","UNK","54 - 77\\\\n54-77","Percent","Increase","UNK","UNK","UNK"
"http://dbmi-icode-01.dbmi.pitt.edu:80/DDI-labels/4b0700c9-b417-4c3a-b36f-de461e125bd3.html","2015-11-29 13:36:22 -0700","DDI-clinical-trial","evidence-challenges","No clinically relevant effect was observed on steady state lithium exposure following coadministration with multiple daily doses of BRINTELLIX.","ncit:negative","ncit:quantitative","lithium","http://dbmi-icode-01.dbmi.pitt.edu:2020/vocab/resource/active-ingredient","dikbD2R:object-drug-of-interaction","UNK","BRINTELLIX","http://dbmi-icode-01.dbmi.pitt.edu:2020/vocab/resource/active-ingredient","dikbD2R:precipitant-drug-of-interaction","UNK","UNK","Oral","UNK","UNK","Oral","UNK","UNK","UNK","UNK","UNK","UNK","UNK","UNK","UNK","UNK","UNK","UNK","UNK","UNK"
"http://dbmi-icode-01.dbmi.pitt.edu:80/DDI-labels/a971ea18-40cf-4a01-b696-180ccc3fddb5.html","2016-02-29 16:08:19 -0500","drug-drug-interaction","evidence-supports","Phenothiazines may lower the convulsive threshold; dosage adjustments of anticonvulsants may be necessary. Potentiation of anticonvulsant effects does not occur. However, it has been reported that phenothiazines may interfere with the metabolism of Dilantin®‡ (phenytoin) and thus precipitate Dilantin (phenytoin) toxicity.","ncit:positive","ncit:Qualitative","Dilantin","http://dbmi-icode-01.dbmi.pitt.edu:2020/vocab/resource/active-ingredient","dikbD2R:object-drug-of-interaction","nodeID://b35153","Phenothiazines","http://dbmi-icode-01.dbmi.pitt.edu:2020/vocab/resource/active-ingredient","dikbD2R:precipitant-drug-of-interaction",,,,,,,,,,,,,,,,,,,,
"http://dbmi-icode-01.dbmi.pitt.edu:80/DDI-labels/51ff7db5-aaf9-4c3c-86e6-958ebf16b60f.html","2015-11-29 12:06:08 -0800","DDI-clinical-trial","evidence-supports","HMG-CoA Reductase Inhibitors – When single 40 mg doses of simvastatin or atorvastatin, both substrates of CYP3A4, were given to healthy adult volunteers who had received nefazodone hydrochloride, 200 mg BID for 6 days, approximately 20 fold increases in plasma concentrations of simvastatin and simvastatin acid and 3 to 4 fold increases in plasma concentrations of atorvastatin and atorvastatin lactone were seen. These effects appear to be due to the inhibition of CYP3A4 by nefazodone because, in the same study, nefazodone had no significant effect on the plasma concentrations of pravastatin, which is not metabolized by CYP3A4 to a clinically significant extent","ncit:positive","ncit:quantitative","nefazodone","http://dbmi-icode-01.dbmi.pitt.edu:2020/vocab/resource/active-ingredient","dikbD2R:precipitant-drug-of-interaction","200","atorvastatin lactone","http://dbmi-icode-01.dbmi.pitt.edu:2020/vocab/resource/metabolite","dikbD2R:object-drug-of-interaction","40","SD","Oral","1","BID","Oral","6","UNK","3 to 4","Fold","Increase","UNK","UNK","UNK","UNK","UNK","UNK","UNK","UNK","UNK"
"http://dbmi-icode-01.dbmi.pitt.edu:80/DDI-labels/51ff7db5-aaf9-4c3c-86e6-958ebf16b60f.html","2015-11-29 10:42:44 -0800","DDI-clinical-trial","evidence-challenges","There were also no changes in the pharmacokinetics of nefazodone or its triazole-dione metabolite, but the AUC and Cmax of mCPP increased by 44% and 48%, respectively, while the AUC of HO-NEF decreased by 19%. No changes in doses of either nefazodone or desipramine are necessary when the two drugs are given concomitantly. Subsequent dose adjustments should be made on the basis of clinical response.","ncit:negative","ncit:quantitative","nefazodone","http://dbmi-icode-01.dbmi.pitt.edu:2020/vocab/resource/active-ingredient","dikbD2R:object-drug-of-interaction","150","desipramine","http://dbmi-icode-01.dbmi.pitt.edu:2020/vocab/resource/active-ingredient","dikbD2R:precipitant-drug-of-interaction","75","BID","Oral","UNK","QD","Oral","UNK","UNK","UNK","UNK","UNK","UNK","UNK","UNK","UNK","UNK","UNK","UNK","UNK","UNK"
"http://dbmi-icode-01.dbmi.pitt.edu:80/DDI-labels/4b0700c9-b417-4c3a-b36f-de461e125bd3.html","2015-11-29 13:44:17 -0700","DDI-clinical-trial","evidence-challenges","Coadministration of aspirin 150 mg/day with multiple daily doses of BRINTELLIX had no significant inhibitory effect on platelet aggregation or pharmacokinetics of aspirin and salicylic acid [see Drug Interactions (7.4)].","ncit:negative","ncit:quantitative","BRINTELLIX","http://dbmi-icode-01.dbmi.pitt.edu:2020/vocab/resource/active-ingredient","dikbD2R:precipitant-drug-of-interaction","UNK","aspirin","http://dbmi-icode-01.dbmi.pitt.edu:2020/vocab/resource/active-ingredient","dikbD2R:object-drug-of-interaction","150","Daily","Oral","UNK","UNK","Oral","UNK","UNK","UNK","UNK","UNK","UNK","UNK","UNK","UNK","UNK","UNK","UNK","UNK","UNK"
"http://dbmi-icode-01.dbmi.pitt.edu:80/DDI-labels/5429f134-839f-4ffc-9944-55f51238def8.html","2015-12-18 15:57:58 -0500","DDI-clinical-trial","evidence-supports","Coadministration of paroxetine with SAPHRIS caused a two-fold increase in the maximum plasma concentrations and    systemic exposure of paroxetine. Asenapine enhances the inhibitory effects of paroxetine on its own metabolism by CYP2D6.","ncit:positive","ncit:quantitative","paroxetine","http://dbmi-icode-01.dbmi.pitt.edu:2020/vocab/resource/active-ingredient","dikbD2R:object-drug-of-interaction","UNK","SAPHRIS","http://dbmi-icode-01.dbmi.pitt.edu:2020/vocab/resource/active-ingredient","dikbD2R:precipitant-drug-of-interaction","UNK","UNK","Oral","UNK","UNK","Oral","UNK","UNK","2","Fold","Increase","UNK","UNK","UNK","2","Fold","Increase","UNK","UNK","UNK"
"http://dbmi-icode-01.dbmi.pitt.edu:80/DDI-labels/51ff7db5-aaf9-4c3c-86e6-958ebf16b60f.html","2015-11-29 10:44:04 -0800","DDI-clinical-trial","evidence-challenges","There were also no changes in the pharmacokinetics of nefazodone or its triazole-dione metabolite, but the AUC and Cmax of mCPP increased by 44% and 48%, respectively, while the AUC of HO-NEF decreased by 19%. No changes in doses of either nefazodone or desipramine are necessary when the two drugs are given concomitantly. Subsequent dose adjustments should be made on the basis of clinical response.","ncit:negative","ncit:quantitative","desipramine","http://dbmi-icode-01.dbmi.pitt.edu:2020/vocab/resource/active-ingredient","dikbD2R:precipitant-drug-of-interaction","75","triazole-dione","http://dbmi-icode-01.dbmi.pitt.edu:2020/vocab/resource/metabolite","dikbD2R:object-drug-of-interaction","150","BID","Oral","UNK","QD","Oral","UNK","UNK","UNK","UNK","UNK","UNKUNUNK","UNK","UNK","UNK","UNK","UNK","UNK","UNK","UNK"
"http://dbmi-icode-01.dbmi.pitt.edu:80/DDI-labels/43452bf8-76e7-47a9-a5d8-41fe84d061f0.html","2015-11-29 14:46:00 -0700","DDI-clinical-trial","evidence-supports","Fluoxetine: Co-administration of fluoxetine (20 mg twice daily for 21 days), a potent inhibitor of CYP2D6, with a single 3 mg dose of iloperidone to 23 healthy volunteers, ages 29 to 44 years, who were classified as CYP2D6 extensive metabolizers, increased the AUC of iloperidone and its metabolite P88, by about 2- to 3-fold, and decreased the AUC of its metabolite P95 by one-half. Iloperidone doses should be reduced by one-half when administered with fluoxetine. ","ncit:positive","ncit:quantitative","P88","http://dbmi-icode-01.dbmi.pitt.edu:2020/vocab/resource/metabolite","dikbD2R:object-drug-of-interaction","3","fluoxetine","http://dbmi-icode-01.dbmi.pitt.edu:2020/vocab/resource/active-ingredient","dikbD2R:precipitant-drug-of-interaction","20","SD","Oral","1","BID","Oral","21","23","2 to 3","Fold","Increase","UNK","UNK","UNK","UNK","UNK","UNK","UNK","UNK","UNK"
"http://dbmi-icode-01.dbmi.pitt.edu:80/DDI-labels/5f0c6f5f-b906-4c8f-8580-3939a476a1c1.html","2016-01-11 10:43:01 -0700","drug-drug-interaction","evidence-supports","Concomitant treatment with CLOZARIL and CYP2D6 or CYP3A4 inhibitors (e.g., cimetidine, escitalopram, erythromycin, paroxetine, bupropion, fluoxetine, quinidine, duloxetine, terbinafine, or sertraline) can increase clozapine levels and lead to adverse reactions [see Clinical Pharmacology (12.3)]. Use caution and monitor patients closely when using such inhibitors. Consider reducing the CLOZARIL dose [see Dosage and Administration (2.6)]","ncit:positive","ncit:Qualitative","clozapine","http://dbmi-icode-01.dbmi.pitt.edu:2020/vocab/resource/active-ingredient","dikbD2R:object-drug-of-interaction","nodeID://b36552","terbinafine","http://dbmi-icode-01.dbmi.pitt.edu:2020/vocab/resource/active-ingredient","dikbD2R:precipitant-drug-of-interaction",,,,,,,,,,,,,,,,,,,,
"http://dbmi-icode-01.dbmi.pitt.edu:80/DDI-labels/d78e9639-6fab-4a78-8b29-6991a18ae6c6.html","2016-02-19 17:46:51 -0500","drug-drug-interaction","evidence-supports","In one study of 45 elderly patients suffering from dementia treated with perphenazine, the 5 patients who were prospectively identified as poor P450 2D6 metabolizers had reported significantly greater side effects during the first 10 days of treatment than the 40 extensive metabolizers, following which the groups tended to converge. Prospective phenotyping of elderly patients prior to antipsychotic treatment may identify those at risk for adverse events.    The concomitant administration of other drugs that inhibit the activity of P450 2D6 may acutely increase plasma concentrations of antipsychotics. Among these are tricyclic antidepressants and selective serotonin reuptake inhibitors, e.g., fluoxetine, sertraline and paroxetine. When prescribing these drugs to patients already receiving antipsychotic therapy, close monitoring is essential and dose reduction may become necessary to avoid toxicity. Lower doses than usually prescribed for either the antipsychotic or the other drug may be required.","ncit:positive","ncit:Qualitative","sertraline","http://dbmi-icode-01.dbmi.pitt.edu:2020/vocab/resource/active-ingredient","dikbD2R:precipitant-drug-of-interaction",,"perphenazine","http://dbmi-icode-01.dbmi.pitt.edu:2020/vocab/resource/active-ingredient","dikbD2R:object-drug-of-interaction","nodeID://b34590",,,,,,,,,,,,,,,,,,,
"http://dbmi-icode-01.dbmi.pitt.edu:80/DDI-labels/49c4105b-e518-481c-a248-6684135f5bc1.html","2015-11-29 16:36:20 -0700","DDI-clinical-trial","evidence-challenges","Repeated oral doses of risperidone (4 mg once daily) did not affect the pre-dose or average plasma concentrations and exposure (AUC) of valproate (1000 mg/day in three divided doses) compared to placebo (n=21). However, there was a 20% increase in valproate peak plasma concentration (Cmax) after concomitant administration of risperidone. Dose adjustment for valproate is not recommended.","ncit:negative","ncit:quantitative","valproate","http://dbmi-icode-01.dbmi.pitt.edu:2020/vocab/resource/active-ingredient","dikbD2R:object-drug-of-interaction","1000","risperidone","http://dbmi-icode-01.dbmi.pitt.edu:2020/vocab/resource/active-ingredient","dikbD2R:precipitant-drug-of-interaction","4","Daily","Oral","UNK","QD","Oral","UNK","21","UNK","UNK","UNK","UNK","UNK","UNK","UNK","UNK","UNK","UNK","UNK","UNK"
"http://dbmi-icode-01.dbmi.pitt.edu:80/DDI-labels/51ff7db5-aaf9-4c3c-86e6-958ebf16b60f.html","2015-11-27 13:51:32 -0800","DDI-clinical-trial","evidence-supports","Buspirone – In a study of steady-state pharmacokinetics in healthy volunteers, coadministration of buspirone (2.5 or 5 mg BID) with nefazodone (250 mg BID) resulted in marked increases in plasma buspirone concentrations (increases up to 20 fold in Cmax and up to 50 fold in AUC) and statistically significant decreases (about 50%) in plasma concentrations of the buspirone metabolite 1-pyrimidinylpiperazine. ","ncit:positive","ncit:quantitative","buspirone","http://dbmi-icode-01.dbmi.pitt.edu:2020/vocab/resource/active-ingredient","dikbD2R:object-drug-of-interaction","2.5 or 5","nefazodone","http://dbmi-icode-01.dbmi.pitt.edu:2020/vocab/resource/active-ingredient","dikbD2R:precipitant-drug-of-interaction","250","BID","Oral","UNK","BID","Oral","UNK","UNK","up to 50","Fold","Increase","UNK","UNK","UNK","up to 20","Fold","Increase","UNK","UNK","UNK"
"http://dbmi-icode-01.dbmi.pitt.edu:80/DDI-labels/51ff7db5-aaf9-4c3c-86e6-958ebf16b60f.html","2015-11-27 12:56:43 -0800","DDI-clinical-trial","evidence-supports","Interaction studies of nefazodone with two triazolobenzodiazepines, i.e., triazolam and alprazolam, metabolized by cytochrome P450 3A4, have revealed substantial and clinically important increases in plasma concentrations of these compounds when administered concomitantly with nefazodone.","ncit:positive","ncit:quantitative","nefazodone","http://dbmi-icode-01.dbmi.pitt.edu:2020/vocab/resource/active-ingredient","dikbD2R:precipitant-drug-of-interaction","UNK","triazolam","http://dbmi-icode-01.dbmi.pitt.edu:2020/vocab/resource/active-ingredient","dikbD2R:object-drug-of-interaction","UNK","UNK","UNK","UNK","UNK","UNK","UNK","UNK","UNK","UNK","UNK","UNK","UNK","UNK","UNK","UNK","UNK","UNK","UNK","UNK"
"http://dbmi-icode-01.dbmi.pitt.edu:80/DDI-labels/51ff7db5-aaf9-4c3c-86e6-958ebf16b60f.html","2015-11-27 12:05:05 -0800","drug-drug-interaction","evidence-supports","The coadministration of triazolam and nefazodone causes a significant increase in the plasma level of triazolam (see WARNINGS and PRECAUTIONS), and a 75% reduction in the initial triazolam dosage is recommended if the two drugs are to be given together. ","ncit:positive","ncit:Qualitative","triazolam","http://dbmi-icode-01.dbmi.pitt.edu:2020/vocab/resource/active-ingredient","dikbD2R:object-drug-of-interaction","nodeID://b29160","nefazodone","http://dbmi-icode-01.dbmi.pitt.edu:2020/vocab/resource/active-ingredient","dikbD2R:precipitant-drug-of-interaction",,,,,,,,,,,,,,,,,,,,
"http://dbmi-icode-01.dbmi.pitt.edu:80/DDI-labels/43452bf8-76e7-47a9-a5d8-41fe84d061f0.html","2016-02-18 18:45:32 -0500","DDI-clinical-trial","evidence-supports","Paroxetine: Co-administration of paroxetine (20 mg/day for 5 to 8 days), a potent inhibitor of CYP2D6, with multiple doses of iloperidone (8 or 12 mg twice daily) to patients with schizophrenia ages 18 to 65 years resulted in increased mean steady-state peak concentrations of iloperidone and its metabolite P88, by about 1.6-fold, and decreased mean steady-state peak concentrations of its metabolite P95 by one-half. Iloperidone doses should be reduced by one-half when administered with paroxetine. ","ncit:positive","ncit:quantitative","P88","http://dbmi-icode-01.dbmi.pitt.edu:2020/vocab/resource/metabolite","dikbD2R:object-drug-of-interaction","8 or 12","paroxetine","http://dbmi-icode-01.dbmi.pitt.edu:2020/vocab/resource/active-ingredient","dikbD2R:precipitant-drug-of-interaction","20","BID","Oral","UNK","Daily","Oral","5 to 8","UNK","UNK","UNK","UNK","UNK","UNK","UNK","1.6","Fold","Increase","UNK","UNK","UNK"
"http://dbmi-icode-01.dbmi.pitt.edu:80/DDI-labels/d5051fbc-846b-4946-82df-341fb1216341.html","2016-02-16 16:22:18 -0700","DDI-clinical-trial","evidence-challenges"," Olanzapine did not influence the pharmacokinetics of diazepam or its active metabolite N-desmethyldiazepam.","ncit:negative","ncit:quantitative","Olanzapine","http://dbmi-icode-01.dbmi.pitt.edu:2020/vocab/resource/active-ingredient","dikbD2R:precipitant-drug-of-interaction","UNK","diazepam","http://dbmi-icode-01.dbmi.pitt.edu:2020/vocab/resource/active-ingredient","dikbD2R:object-drug-of-interaction","UNK","UNK","Oral","UNK","UNK","Oral","UNK","UNK","UNK","UNK","UNK","UNK","UNK","UNK","UNK","UNK","UNK","UNK","UNK","UNK"
"http://dbmi-icode-01.dbmi.pitt.edu:80/DDI-labels/51ff7db5-aaf9-4c3c-86e6-958ebf16b60f.html","2015-11-29 10:51:40 -0800","DDI-clinical-trial","evidence-challenges","Lithium – In 13 healthy subjects the coadministration of nefazodone (200 mg BID) with lithium (500 mg BID) for 5 days (steady-state conditions) was found to be well tolerated. When the two drugs were coadministered, there were no changes in the steady-state pharmacokinetics of either lithium, nefazodone, or its metabolite HO-NEF; however, there were small decreases in the steady-state plasma concentrations of two nefazodone metabolites, mCPP and triazole-dione, which are considered not to be of clinical significance. Therefore, no dosage adjustment of either lithium or nefazodone is required when they are coadministered.","ncit:negative","ncit:quantitative","Lithium","http://dbmi-icode-01.dbmi.pitt.edu:2020/vocab/resource/active-ingredient","dikbD2R:precipitant-drug-of-interaction","500","nefazodone","http://dbmi-icode-01.dbmi.pitt.edu:2020/vocab/resource/active-ingredient","dikbD2R:object-drug-of-interaction","200","BID","Oral","5","BID","Oral","5","13","UNK","UNK","UNK","UNK","UNK","UNK","UNK","UNK","UNK","UNK","UNK","UNK"
