"source","date","assertionType","evidenceType","exactText","modality","statementType","drug1Lab","drug1Type","drug1Role","dose1","drug2Lab","drug2Type","drug2Role","dose2","objectRegimens","objectFormulation","objectDuration","preciptRegimens","preciptFormulation","preciptDuration","numOfParticipants","auc","aucType","aucDirection","cl","clType","clDirection","cmax","cmaxType","cmaxDirection","t12","t12Type","t12Direction"
"http://dbmi-icode-01.dbmi.pitt.edu:80/DDI-labels/51ff7db5-aaf9-4c3c-86e6-958ebf16b60f.html","2015-11-29 11:09:54 -0800","DDI-clinical-trial","evidence-challenges","When nefazodone (200 mg BID) was given to patients being treated with theophylline (600 to 1200 mg/day) for chronic obstructive pulmonary disease, there was no change in the steady-state pharmacokinetics of either nefazodone or theophylline. FEV1 measurements taken when theophylline and nefazodone were coadministered did not differ from baseline dosage (i.e., when theophylline was administered alone). Therefore, dosage adjustment is not necessary for either drug when coadministered.","ncit:negative","ncit:quantitative","theophylline","http://dbmi-icode-01.dbmi.pitt.edu:2020/vocab/resource/active-ingredient","dikbD2R:object-drug-of-interaction","600 to 1200","nefazodone","http://dbmi-icode-01.dbmi.pitt.edu:2020/vocab/resource/active-ingredient","dikbD2R:precipitant-drug-of-interaction","200","Daily","Oral","UNK","BID","Oral","UNK","UNK","UNK","UNK","UNK","UNK","UNK","UNK","UNK","UNK","UNK","UNK","UNK","UNK"
"http://dbmi-icode-01.dbmi.pitt.edu:80/DDI-labels/d5051fbc-846b-4946-82df-341fb1216341.html","2016-02-16 13:18:12 -0700","DDI-clinical-trial","evidence-challenges","Multiple doses of olanzapine (10 mg for 8 days) did not influence the kinetics of lithium. ","ncit:negative","ncit:quantitative","lithium.","http://dbmi-icode-01.dbmi.pitt.edu:2020/vocab/resource/active-ingredient","dikbD2R:object-drug-of-interaction","UNK","olanzapine","http://dbmi-icode-01.dbmi.pitt.edu:2020/vocab/resource/active-ingredient","dikbD2R:precipitant-drug-of-interaction","10","UNK","Oral","UNK","UNK","Oral","8","UNK","UNK","UNK","UNK","UNK","UNK","UNK","UNK","UNK","UNK","UNK","UNK","UNK"
"http://dbmi-icode-01.dbmi.pitt.edu:80/DDI-labels/51ff7db5-aaf9-4c3c-86e6-958ebf16b60f.html","2015-11-29 11:23:33 -0800","DDI-clinical-trial","evidence-supports","Digoxin – When nefazodone (200 mg BID) and digoxin (0.2 mg QD) were coadministered for 9 days to healthy male volunteers (n = 18) who were phenotyped as CYP2D6 extensive metabolizers, Cmax, Cmin, and AUC of digoxin were increased by 29%, 27%, and 15%, respectively.","ncit:positive","ncit:quantitative","nefazodone","http://dbmi-icode-01.dbmi.pitt.edu:2020/vocab/resource/active-ingredient","dikbD2R:precipitant-drug-of-interaction","200","digoxin","http://dbmi-icode-01.dbmi.pitt.edu:2020/vocab/resource/active-ingredient","dikbD2R:object-drug-of-interaction",".2","QD","Oral","9","BID","Oral","9","18","15","Percent","Increase","UNK","UNK","UNK","29","Percent","Increase","UNK","UNK","UNK"
"http://dbmi-icode-01.dbmi.pitt.edu:80/DDI-labels/9c4bedb4-2d59-4fcd-aad7-fce988cd96d8.html","2016-02-29 14:22:02 -0700","drug-drug-interaction","evidence-supports","Reduced cytochrome P450 2D6 isozyme activity drugs that inhibit this isozyme (e.g., fluoxetine and paroxetine) and certain other drugs (e.g., fluvoxamine, propranolol, and pindolol) appear to appreciably inhibit the metabolism of thioridazine. The resulting elevated levels of thioridazine would be expected to augment the prolongation of the QTc interval associated with thioridazine and may increase the risk of serious, potentially fatal, cardiac arrhythmias, such as Torsades de pointes type arrhythmias.","ncit:positive","ncit:Qualitative","pindolol","http://dbmi-icode-01.dbmi.pitt.edu:2020/vocab/resource/active-ingredient","dikbD2R:precipitant-drug-of-interaction",,"thioridazine","http://dbmi-icode-01.dbmi.pitt.edu:2020/vocab/resource/active-ingredient","dikbD2R:object-drug-of-interaction","nodeID://b35641",,,,,,,,,,,,,,,,,,,
"http://dbmi-icode-01.dbmi.pitt.edu:80/DDI-labels/d5051fbc-846b-4946-82df-341fb1216341.html","2016-02-16 18:26:57 -0500","DDI-clinical-trial","evidence-challenges","Multiple doses of olanzapine did not affect the pharmacokinetics of theophylline or its metabolites. ","ncit:negative","ncit:quantitative","theophylline","http://dbmi-icode-01.dbmi.pitt.edu:2020/vocab/resource/active-ingredient","dikbD2R:object-drug-of-interaction","UNK","olanzapine","http://dbmi-icode-01.dbmi.pitt.edu:2020/vocab/resource/active-ingredient","dikbD2R:precipitant-drug-of-interaction","UNK","UNK","Oral","UNK","UNK","Oral","UNK","UNK","UNK","UNK","UNK","UNK","UNK","UNK","UNK","UNK","UNK","UNK","UNK","UNK"
"http://dbmi-icode-01.dbmi.pitt.edu:80/DDI-labels/51ff7db5-aaf9-4c3c-86e6-958ebf16b60f.html","2015-11-29 11:47:05 -0800","DDI-clinical-trial","evidence-challenges","Propranolol – The coadministration of nefazodone (200 mg BID) and propranolol (40 mg BID) for 5.5 days to healthy male volunteers (n = 18), including 3 poor and 15 extensive CYP2D6 metabolizers, resulted in 30% and 14% reductions in Cmax and AUC of propranolol, respectively, and a 14% reduction in Cmax for the metabolite, 4-hydroxypropranolol. The kinetics of nefazodone, hydroxynefazodone, and triazole-dione were not affected by coadministration of propranolol. However, Cmax, Cmin, and AUC of m-chlorophenylpiperazine were increased by 23%, 54%, and 28%, respectively. No change in initial dose of either drug is necessary and dose adjustments should be made on the basis of clinical response.","ncit:negative","ncit:quantitative","propranolol","http://dbmi-icode-01.dbmi.pitt.edu:2020/vocab/resource/active-ingredient","dikbD2R:precipitant-drug-of-interaction","40","nefazodone","http://dbmi-icode-01.dbmi.pitt.edu:2020/vocab/resource/active-ingredient","dikbD2R:object-drug-of-interaction","200","BID","Oral","5.5","BID","Oral","5.5","18","UNK","UNK","UNK","UNK","UNK","UNK","UNK","UNK","UNK","UNK","UNK","UNK"
"http://dbmi-icode-01.dbmi.pitt.edu:80/DDI-labels/51ff7db5-aaf9-4c3c-86e6-958ebf16b60f.html","2015-11-29 12:08:12 -0800","DDI-clinical-trial","evidence-challenges","HMG-CoA Reductase Inhibitors – When single 40 mg doses of simvastatin or atorvastatin, both substrates of CYP3A4, were given to healthy adult volunteers who had received nefazodone hydrochloride, 200 mg BID for 6 days, approximately 20 fold increases in plasma concentrations of simvastatin and simvastatin acid and 3 to 4 fold increases in plasma concentrations of atorvastatin and atorvastatin lactone were seen. These effects appear to be due to the inhibition of CYP3A4 by nefazodone because, in the same study, nefazodone had no significant effect on the plasma concentrations of pravastatin, which is not metabolized by CYP3A4 to a clinically significant extent","ncit:negative","ncit:quantitative","pravastatin","http://dbmi-icode-01.dbmi.pitt.edu:2020/vocab/resource/active-ingredient","dikbD2R:object-drug-of-interaction","UNK","nefazodone","http://dbmi-icode-01.dbmi.pitt.edu:2020/vocab/resource/active-ingredient","dikbD2R:precipitant-drug-of-interaction","200","UNK","Oral","UNK","BID","Oral","6","UNK","UNK","UNK","UNK","UNK","UNK","UNK","UNK","UNK","UNK","UNK","UNK","UNK"
"http://dbmi-icode-01.dbmi.pitt.edu:80/DDI-labels/7b8e5b26-b9e4-4704-921b-3c3c0d159916.html","2015-11-29 16:15:29 -0700","drug-drug-interaction","evidence-challenges","In a clinical study, subjects on stable doses of valproate had comparable valproate average plasma concentrations when INVEGA® 3–15 mg/day was added to their existing valproate treatment.","ncit:negative","ncit:Qualitative","INVEGA","http://dbmi-icode-01.dbmi.pitt.edu:2020/vocab/resource/active-ingredient","dikbD2R:precipitant-drug-of-interaction",,"valproate","http://dbmi-icode-01.dbmi.pitt.edu:2020/vocab/resource/active-ingredient","dikbD2R:object-drug-of-interaction","nodeID://b31168",,,,,,,,,,,,,,,,,,,
"http://dbmi-icode-01.dbmi.pitt.edu:80/DDI-labels/a971ea18-40cf-4a01-b696-180ccc3fddb5.html","2016-02-29 16:08:19 -0500","drug-drug-interaction","evidence-supports","Concomitant administration of propranolol with phenothiazines results in increased plasma levels of both drugs","ncit:positive","ncit:Qualitative","phenothiazines","http://dbmi-icode-01.dbmi.pitt.edu:2020/vocab/resource/active-ingredient","dikbD2R:precipitant-drug-of-interaction",,"propranolol","http://dbmi-icode-01.dbmi.pitt.edu:2020/vocab/resource/active-ingredient","dikbD2R:object-drug-of-interaction","nodeID://b32066",,,,,,,,,,,,,,,,,,,
"http://dbmi-icode-01.dbmi.pitt.edu:80/DDI-labels/51ff7db5-aaf9-4c3c-86e6-958ebf16b60f.html","2015-11-29 11:37:36 -0800","DDI-clinical-trial","evidence-challenges","Digoxin – When nefazodone (200 mg BID) and digoxin (0.2 mg QD) were coadministered for 9 days to healthy male volunteers (n = 18) who were phenotyped as CYP2D6 extensive metabolizers, Cmax, Cmin, and AUC of digoxin were increased by 29%, 27%, and 15%, respectively. Digoxin had no effects on the pharmacokinetics of nefazodone and its active metabolites. Because of the narrow therapeutic index of digoxin, caution should be exercised when nefazodone and digoxin are coadministered; plasma level monitoring for digoxin is recommended.","ncit:negative","ncit:quantitative","digoxin","http://dbmi-icode-01.dbmi.pitt.edu:2020/vocab/resource/active-ingredient","dikbD2R:precipitant-drug-of-interaction",".2","nefazodone","http://dbmi-icode-01.dbmi.pitt.edu:2020/vocab/resource/active-ingredient","dikbD2R:object-drug-of-interaction","200","BID","Oral","9","QD","Oral","9","18","UNK","UNK","UNK","UNK","UNK","UNK","UNK","UNK","UNK","UNK","UNK","UNK"
"http://dbmi-icode-01.dbmi.pitt.edu:80/DDI-labels/7b8e5b26-b9e4-4704-921b-3c3c0d159916.html","2015-11-29 18:21:18 -0500","DDI-clinical-trial","evidence-supports","Co-administration of a single dose of INVEGA® 12 mg with divalproex sodium extended-release tablets (two 500 mg tablets once daily) resulted in an increase of approximately 50% in the Cmax and AUC of paliperidone. Dosage reduction for INVEGA® should be considered when INVEGA® is co-administered with valproate after clinical assessment.","ncit:positive","ncit:quantitative","INVEGA","http://dbmi-icode-01.dbmi.pitt.edu:2020/vocab/resource/active-ingredient","dikbD2R:object-drug-of-interaction","12","divalproex sodium","http://dbmi-icode-01.dbmi.pitt.edu:2020/vocab/resource/active-ingredient","dikbD2R:precipitant-drug-of-interaction","1000","SD","Oral","1","QD","Oral","UNK","UNK","50","Percent","Increase","UNK","UNK","UNK","50","Percent","Increase","UNK","UNK","UNK"
"http://dbmi-icode-01.dbmi.pitt.edu:80/DDI-labels/afad3051-9df2-4c54-9684-e8262a133af8.html","2015-12-08 19:34:38 -0700","DDI-clinical-trial","evidence-challenges","Valproate: It is not necessary to adjust the LATUDA dose when used concomitantly with valproate. A dedicated drug-drug interaction study has not been conducted with valproate and LATUDA. Based on pharmacokinetic data from the bipolar depression studies valproate levels were not affected by lurasidone, and lurasidone concentrations were not affected by valproate. ","ncit:negative","ncit:quantitative","lurasidone","http://dbmi-icode-01.dbmi.pitt.edu:2020/vocab/resource/active-ingredient","dikbD2R:precipitant-drug-of-interaction","UNK","valproate","http://dbmi-icode-01.dbmi.pitt.edu:2020/vocab/resource/active-ingredient","dikbD2R:object-drug-of-interaction","UNK","UNK","Oral","UNK","UNK","Oral","UNK","UNK","UNK","UNK","UNK","UNK","UNK","UNK","UNK","UNK","UNK","UNK","UNK","UNK"
"http://dbmi-icode-01.dbmi.pitt.edu:80/DDI-labels/5f0c6f5f-b906-4c8f-8580-3939a476a1c1.html","2016-01-11 10:39:55 -0700","drug-drug-interaction","evidence-supports","Concomitant treatment with CLOZARIL and CYP2D6 or CYP3A4 inhibitors (e.g., cimetidine, escitalopram, erythromycin, paroxetine, bupropion, fluoxetine, quinidine, duloxetine, terbinafine, or sertraline) can increase clozapine levels and lead to adverse reactions [see Clinical Pharmacology (12.3)]. Use caution and monitor patients closely when using such inhibitors. Consider reducing the CLOZARIL dose [see Dosage and Administration (2.6)].","ncit:positive","ncit:Qualitative","escitalopram","http://dbmi-icode-01.dbmi.pitt.edu:2020/vocab/resource/active-ingredient","dikbD2R:precipitant-drug-of-interaction",,"clozapine","http://dbmi-icode-01.dbmi.pitt.edu:2020/vocab/resource/active-ingredient","dikbD2R:object-drug-of-interaction","nodeID://b30746",,,,,,,,,,,,,,,,,,,
"http://dbmi-icode-01.dbmi.pitt.edu:80/DDI-labels/5f0c6f5f-b906-4c8f-8580-3939a476a1c1.html","2016-01-11 10:41:56 -0700","drug-drug-interaction","evidence-supports","Concomitant treatment with CLOZARIL and CYP2D6 or CYP3A4 inhibitors (e.g., cimetidine, escitalopram, erythromycin, paroxetine, bupropion, fluoxetine, quinidine, duloxetine, terbinafine, or sertraline) can increase clozapine levels and lead to adverse reactions [see Clinical Pharmacology (12.3)]. Use caution and monitor patients closely when using such inhibitors. Consider reducing the CLOZARIL dose [see Dosage and Administration (2.6)]","ncit:positive","ncit:Qualitative","quinidine","http://dbmi-icode-01.dbmi.pitt.edu:2020/vocab/resource/active-ingredient","dikbD2R:precipitant-drug-of-interaction",,"clozapine","http://dbmi-icode-01.dbmi.pitt.edu:2020/vocab/resource/active-ingredient","dikbD2R:object-drug-of-interaction","nodeID://b35194",,,,,,,,,,,,,,,,,,,
"http://dbmi-icode-01.dbmi.pitt.edu:80/DDI-labels/51ff7db5-aaf9-4c3c-86e6-958ebf16b60f.html","2015-11-29 11:07:13 -0800","DDI-clinical-trial","evidence-challenges","When nefazodone (200 mg BID) and cimetidine (300 mg QID) were coadministered for one week, no change in the steady-state pharmacokinetics of either nefazodone or cimetidine was observed compared to each dosed alone. Therefore, dosage adjustment is not necessary for either drug when coadministered.","ncit:negative","ncit:quantitative","nefazodone","http://dbmi-icode-01.dbmi.pitt.edu:2020/vocab/resource/active-ingredient","dikbD2R:object-drug-of-interaction","200","cimetidine","http://dbmi-icode-01.dbmi.pitt.edu:2020/vocab/resource/active-ingredient","dikbD2R:precipitant-drug-of-interaction","300","BID","Oral","7","QID","Oral","7","UNK","UNK","UNK","UNK","UNK","UNK","UNK","UNK","UNK","UNK","UNK","UNK","UNK"
"http://dbmi-icode-01.dbmi.pitt.edu:80/DDI-labels/d78e9639-6fab-4a78-8b29-6991a18ae6c6.html","2016-02-19 17:46:51 -0500","drug-drug-interaction","evidence-supports","In one study of 45 elderly patients suffering from dementia treated with perphenazine, the 5 patients who were prospectively identified as poor P450 2D6 metabolizers had reported significantly greater side effects during the first 10 days of treatment than the 40 extensive metabolizers, following which the groups tended to converge. Prospective phenotyping of elderly patients prior to antipsychotic treatment may identify those at risk for adverse events.    The concomitant administration of other drugs that inhibit the activity of P450 2D6 may acutely increase plasma concentrations of antipsychotics. Among these are tricyclic antidepressants and selective serotonin reuptake inhibitors, e.g., fluoxetine, sertraline and paroxetine. When prescribing these drugs to patients already receiving antipsychotic therapy, close monitoring is essential and dose reduction may become necessary to avoid toxicity. Lower doses than usually prescribed for either the antipsychotic or the other drug may be required.","ncit:positive","ncit:Qualitative","fluoxetine","http://dbmi-icode-01.dbmi.pitt.edu:2020/vocab/resource/active-ingredient","dikbD2R:precipitant-drug-of-interaction",,"perphenazine","http://dbmi-icode-01.dbmi.pitt.edu:2020/vocab/resource/active-ingredient","dikbD2R:object-drug-of-interaction","nodeID://b29908",,,,,,,,,,,,,,,,,,,
"http://dbmi-icode-01.dbmi.pitt.edu:80/DDI-labels/9c4bedb4-2d59-4fcd-aad7-fce988cd96d8.html","2016-02-29 14:37:32 -0700","DDI-clinical-trial","evidence-supports","The effect of fluvoxamine (25 mg b.i.d. for one week) on thioridazine steady-state concentration was evaluated in ten male inpatients with schizophrenia. Concentrations of thioridazine and its two active metabolites, mesoridazine and sulforidazine, increased 3-fold following coadministration of fluvoxamine. Fluvoxamine and thioridazine should not be coadministered.","ncit:positive","ncit:quantitative","mesoridazine","http://dbmi-icode-01.dbmi.pitt.edu:2020/vocab/resource/active-ingredient","dikbD2R:precipitant-drug-of-interaction","25","Fluvoxamine","http://dbmi-icode-01.dbmi.pitt.edu:2020/vocab/resource/active-ingredient","dikbD2R:object-drug-of-interaction","UNK","UNK","Oral","UNK","BID","Oral","7","10","3","Fold","Increase","UNK","UNK","UNK","UNK","UNK","UNK","UNK","UNK","UNK"
"http://dbmi-icode-01.dbmi.pitt.edu:80/DDI-labels/43452bf8-76e7-47a9-a5d8-41fe84d061f0.html","2015-11-29 15:19:40 -0700","DDI-clinical-trial","evidence-challenges","luoxetine: A single 3 mg dose of iloperidone had no effect on the pharmacokinetics of fluoxetine (20 mg twice daily). ","ncit:negative","ncit:quantitative","fluoxetine","http://dbmi-icode-01.dbmi.pitt.edu:2020/vocab/resource/active-ingredient","dikbD2R:object-drug-of-interaction","20","iloperidone","http://dbmi-icode-01.dbmi.pitt.edu:2020/vocab/resource/active-ingredient","dikbD2R:precipitant-drug-of-interaction","3","BID","Oral","UNK","SD","Oral","1","UNK","UNK","UNK","UNK","UNK","UNK","UNK","UNK","UNK","UNK","UNK","UNK","UNK"
"http://dbmi-icode-01.dbmi.pitt.edu:80/DDI-labels/51ff7db5-aaf9-4c3c-86e6-958ebf16b60f.html","2015-11-27 13:12:47 -0800","DDI-clinical-trial","evidence-challenges","Nefazodone plasma concentrations were unaffected by alprazolam. ","ncit:negative","ncit:quantitative","Nefazodone","http://dbmi-icode-01.dbmi.pitt.edu:2020/vocab/resource/active-ingredient","dikbD2R:object-drug-of-interaction","200","alprazolam","http://dbmi-icode-01.dbmi.pitt.edu:2020/vocab/resource/active-ingredient","dikbD2R:precipitant-drug-of-interaction","1","BID","Oral","UNK","BID","Oral","UNK","UNK","UNK","UNK","UNK","UNK","UNK","UNK","UNK","UNK","UNK","UNK","UNK","UNK"
"http://dbmi-icode-01.dbmi.pitt.edu:80/DDI-labels/51ff7db5-aaf9-4c3c-86e6-958ebf16b60f.html","2015-11-27 14:24:30 -0800","DDI-clinical-trial","evidence-challenges"," When fluoxetine (20 mg QD) and nefazodone (200 mg BID) were administered at steady state there were no changes in the pharmacokinetic parameters for fluoxetine or its metabolite, norfluoxetine.","ncit:negative","ncit:quantitative","nefazodone","http://dbmi-icode-01.dbmi.pitt.edu:2020/vocab/resource/active-ingredient","dikbD2R:precipitant-drug-of-interaction","200","norfluoxetine","http://dbmi-icode-01.dbmi.pitt.edu:2020/vocab/resource/metabolite","dikbD2R:object-drug-of-interaction","20","QD","Oral","UNK","BID","Oral","UNK","UNK","UNK","UNK","UNK","UNK","UNK","UNK","UNK","UNK","UNK","UNK","UNK","UNK"
"http://dbmi-icode-01.dbmi.pitt.edu:80/DDI-labels/51ff7db5-aaf9-4c3c-86e6-958ebf16b60f.html","2015-11-29 10:40:46 -0800","DDI-clinical-trial","evidence-challenges","Desipramine – When nefazodone (150 mg BID) and desipramine (75 mg QD) were administered together there were no changes in the pharmacokinetics of desipramine or its metabolite, 2-hydroxy desipramine. ","ncit:negative","ncit:quantitative","2-hydroxy desipramine.","http://dbmi-icode-01.dbmi.pitt.edu:2020/vocab/resource/metabolite","dikbD2R:object-drug-of-interaction","75","nefazodone","http://dbmi-icode-01.dbmi.pitt.edu:2020/vocab/resource/active-ingredient","dikbD2R:precipitant-drug-of-interaction","150","QD","Oral","UNK","BID","Oral","UNK","UNK","UNK","UNK","UNK","UNK","UNK","UNK","UNK","UNK","UNK","UNK","UNK","UNK"
"http://dbmi-icode-01.dbmi.pitt.edu:80/DDI-labels/9c4bedb4-2d59-4fcd-aad7-fce988cd96d8.html","2016-02-29 16:44:38 -0500","drug-drug-interaction","evidence-supports","Concurrent administration of pindolol and thioridazine have resulted in moderate, dose related increases in the serum levels of thioridazine and two of its metabolites, as well as higher than expected serum pindolol levels. Pindolol and thioridazine should not be coadministered.","ncit:positive","ncit:Qualitative","pindolol","http://dbmi-icode-01.dbmi.pitt.edu:2020/vocab/resource/active-ingredient","dikbD2R:precipitant-drug-of-interaction",,"thioridazine","http://dbmi-icode-01.dbmi.pitt.edu:2020/vocab/resource/active-ingredient","dikbD2R:object-drug-of-interaction","nodeID://b36565",,,,,,,,,,,,,,,,,,,
"http://dbmi-icode-01.dbmi.pitt.edu:80/DDI-labels/51ff7db5-aaf9-4c3c-86e6-958ebf16b60f.html","2015-11-27 14:07:38 -0800","DDI-clinical-trial","evidence-supports","With 5 mg BID doses of buspirone, slight increases in AUC were observed for nefazodone (23%) and its metabolites hydroxynefazodone (17%) and mCPP (9%)","ncit:positive","ncit:quantitative","hydroxynefazodone","http://dbmi-icode-01.dbmi.pitt.edu:2020/vocab/resource/metabolite","dikbD2R:object-drug-of-interaction","250","buspirone","http://dbmi-icode-01.dbmi.pitt.edu:2020/vocab/resource/active-ingredient","dikbD2R:precipitant-drug-of-interaction","5","BID","Oral","UNK","BID","Oral","UNK","UNK","17","Percent","Increase","UNK","UNK","UNK","UNK","UNK","UNK","UNK","UNK","UNK"
"http://dbmi-icode-01.dbmi.pitt.edu:80/DDI-labels/d5051fbc-846b-4946-82df-341fb1216341.html","2016-02-16 12:46:01 -0700","drug-drug-interaction","evidence-supports"," Omeprazole and rifampin may cause an increase in olanzapine clearance. ","ncit:positive","ncit:Qualitative","olanzapine","http://dbmi-icode-01.dbmi.pitt.edu:2020/vocab/resource/active-ingredient","dikbD2R:object-drug-of-interaction","nodeID://b34815","Omeprazole","http://dbmi-icode-01.dbmi.pitt.edu:2020/vocab/resource/active-ingredient","dikbD2R:precipitant-drug-of-interaction",,,,,,,,,,,,,,,,,,,,
"http://dbmi-icode-01.dbmi.pitt.edu:80/DDI-labels/51ff7db5-aaf9-4c3c-86e6-958ebf16b60f.html","2015-11-29 12:00:53 -0800","DDI-clinical-trial","evidence-supports","HMG-CoA Reductase Inhibitors – When single 40 mg doses of simvastatin or atorvastatin, both substrates of CYP3A4, were given to healthy adult volunteers who had received nefazodone hydrochloride, 200 mg BID for 6 days, approximately 20 fold increases in plasma concentrations of simvastatin and simvastatin acid and 3 to 4 fold increases in plasma concentrations of atorvastatin and atorvastatin lactone were seen. These effects appear to be due to the inhibition of CYP3A4 by nefazodone because, in the same study, nefazodone had no significant effect on the plasma concentrations of pravastatin, which is not metabolized by CYP3A4 to a clinically significant extent.","ncit:positive","ncit:quantitative","nefazodone","http://dbmi-icode-01.dbmi.pitt.edu:2020/vocab/resource/active-ingredient","dikbD2R:precipitant-drug-of-interaction","200","simvastatin","http://dbmi-icode-01.dbmi.pitt.edu:2020/vocab/resource/active-ingredient","dikbD2R:object-drug-of-interaction","40","QD","Oral","1","BID","Oral","6","UNK","20","Fold","Increase","UNK","UNK","UNK","UNK","UNK","UNK","UNK","UNK","UNK"
"http://dbmi-icode-01.dbmi.pitt.edu:80/DDI-labels/51ff7db5-aaf9-4c3c-86e6-958ebf16b60f.html","2015-11-27 14:35:40 -0800","DDI-clinical-trial","evidence-supports","When fluoxetine (20 mg QD) and nefazodone (200 mg BID) were administered at steady state there were no changes in the pharmacokinetic parameters for fluoxetine or its metabolite, norfluoxetine. Similarly, there were no changes in the pharmacokinetic parameters of nefazodone or HO-NEF; however, the mean AUC levels of the nefazodone metabolites mCPP and triazole-dione increased by 3 to 6 fold and 1.3 fold, respectively","ncit:positive","ncit:quantitative","triazole-dione","http://dbmi-icode-01.dbmi.pitt.edu:2020/vocab/resource/metabolite","dikbD2R:object-drug-of-interaction","200","fluoxetine","http://dbmi-icode-01.dbmi.pitt.edu:2020/vocab/resource/active-ingredient","dikbD2R:precipitant-drug-of-interaction","20","BID","Oral","UNK","QD","Oral","UNK","UNK","1.3","Fold","Increase","UNK","UNK","UNK","UNK","UNK","UNK","UNK","UNK","UNK"
"http://dbmi-icode-01.dbmi.pitt.edu:80/DDI-labels/4e1e5249-1cb7-4cc2-ad5a-cdeeee2f494f.html","2016-02-16 16:33:50 -0700","drug-drug-interaction","evidence-supports","Quetiapine exposure is increased by the prototype CYP3A4 inhibitors (e.g., ketoconazole, itraconazole, indinavir, ritonavir, nefazodone, etc.)","ncit:positive","ncit:Qualitative","Quetiapine","http://dbmi-icode-01.dbmi.pitt.edu:2020/vocab/resource/active-ingredient","dikbD2R:object-drug-of-interaction","nodeID://b35859","ketoconazole","http://dbmi-icode-01.dbmi.pitt.edu:2020/vocab/resource/active-ingredient","dikbD2R:precipitant-drug-of-interaction",,,,,,,,,,,,,,,,,,,,
"http://dbmi-icode-01.dbmi.pitt.edu:80/DDI-labels/51ff7db5-aaf9-4c3c-86e6-958ebf16b60f.html","2015-11-29 11:41:53 -0800","DDI-clinical-trial","evidence-supports","Propranolol – The coadministration of nefazodone (200 mg BID) and propranolol (40 mg BID) for 5.5 days to healthy male volunteers (n = 18), including 3 poor and 15 extensive CYP2D6 metabolizers, resulted in 30% and 14% reductions in Cmax and AUC of propranolol, respectively, and a 14% reduction in Cmax for the metabolite, 4-hydroxypropranolol.","ncit:positive","ncit:quantitative","4-hydroxypropranolol","http://dbmi-icode-01.dbmi.pitt.edu:2020/vocab/resource/metabolite","dikbD2R:object-drug-of-interaction","40","nefazodone","http://dbmi-icode-01.dbmi.pitt.edu:2020/vocab/resource/active-ingredient","dikbD2R:precipitant-drug-of-interaction","200","BID","Oral","5.5","BID","Oral","5.5","18","UNK","UNK","UNK","UNK","UNK","UNK","14","Percent","Decrease","UNK","UNK","UNK"
