"source","date","assertionType","evidenceType","exactText","modality","statementType","drug1Lab","drug1Type","drug1Role","dose1","drug2Lab","drug2Type","drug2Role","dose2","objectRegimens","objectFormulation","objectDuration","preciptRegimens","preciptFormulation","preciptDuration","numOfParticipants","auc","aucType","aucDirection","cl","clType","clDirection","cmax","cmaxType","cmaxDirection","t12","t12Type","t12Direction"
"http://dbmi-icode-01.dbmi.pitt.edu:80/DDI-labels/51ff7db5-aaf9-4c3c-86e6-958ebf16b60f.html","2015-11-29 11:51:10 -0800","DDI-clinical-trial","evidence-supports","Propranolol – The coadministration of nefazodone (200 mg BID) and propranolol (40 mg BID) for 5.5 days to healthy male volunteers (n = 18), including 3 poor and 15 extensive CYP2D6 metabolizers, resulted in 30% and 14% reductions in Cmax and AUC of propranolol, respectively, and a 14% reduction in Cmax for the metabolite, 4-hydroxypropranolol. The kinetics of nefazodone, hydroxynefazodone, and triazole-dione were not affected by coadministration of propranolol. However, Cmax, Cmin, and AUC of m-chlorophenylpiperazine were increased by 23%, 54%, and 28%, respectively. No change in initial dose of either drug is necessary and dose adjustments should be made on the basis of clinical response.","ncit:positive","ncit:quantitative","m-chlorophenylpiperazine","http://dbmi-icode-01.dbmi.pitt.edu:2020/vocab/resource/metabolite","dikbD2R:object-drug-of-interaction","200","propranolol","http://dbmi-icode-01.dbmi.pitt.edu:2020/vocab/resource/active-ingredient","dikbD2R:precipitant-drug-of-interaction","40","BID","Oral","5.5","BID","Oral","5.5","18","28","Percent","Increase","UNK","UNK","UNK","23","Percent","Increase","UNK","UNK","UNK"
"http://dbmi-icode-01.dbmi.pitt.edu:80/DDI-labels/036db1f2-52b3-42a0-acf9-817b7ba8c724.html","2015-12-08 18:59:13 -0700","DDI-clinical-trial","evidence-challenges","Consistent with in vitro results, a study in normal healthy volunteers showed that ziprasidone did not alter the metabolism of dextromethorphan, a CYP2D6 model substrate, to its major metabolite, dextrorphan. There was no statistically significant change in the urinary dextromethorphan/dextrorphan ratio.","ncit:negative","ncit:quantitative","dextrorphan","http://dbmi-icode-01.dbmi.pitt.edu:2020/vocab/resource/active-ingredient","dikbD2R:object-drug-of-interaction","UNK","ziprasidone","http://dbmi-icode-01.dbmi.pitt.edu:2020/vocab/resource/active-ingredient","dikbD2R:precipitant-drug-of-interaction","UNK","UNK","Oral","UNK","UNK","Oral","UNK","UNK","UNK","UNK","UNK","UNK","UNK","UNK","UNK","UNK","UNK","UNK","UNK","UNK"
"http://dbmi-icode-01.dbmi.pitt.edu:80/DDI-labels/4b0700c9-b417-4c3a-b36f-de461e125bd3.html","2015-11-29 15:59:31 -0500","DDI-clinical-trial","evidence-challenges","Because vortioxetine is highly bound to plasma protein, coadministration of BRINTELLIX with another drug that is highly protein bound may increase free concentrations of the other drug. However, in a clinical study with coadministration of BRINTELLIX (10 mg/day) and warfarin (1 mg/day to 10 mg/day), a highly protein-bound drug, no significant change in INR was observed [see Drug Interactions (7.2)].","ncit:negative","ncit:quantitative","warfarin","http://dbmi-icode-01.dbmi.pitt.edu:2020/vocab/resource/active-ingredient","dikbD2R:object-drug-of-interaction","1 to 10","BRINTELLIX","http://dbmi-icode-01.dbmi.pitt.edu:2020/vocab/resource/active-ingredient","dikbD2R:precipitant-drug-of-interaction","UNK","Daily","Oral","UNK","UNK","Oral","UNK","UNK","UNK","UNK","UNK","UNK","UNK","UNK","UNK","UNK","UNK","UNK","UNK","UNK"
"http://dbmi-icode-01.dbmi.pitt.edu:80/DDI-labels/5f0c6f5f-b906-4c8f-8580-3939a476a1c1.html","2016-02-18 18:51:21 -0500","DDI-clinical-trial","evidence-supports","A pharmacokinetic study was conducted in 16 schizophrenic patients who received clozapine under steady-state conditions. After coadministration of fluvoxamine for 14 days, mean trough concentrations of clozapine and its metabolites, N-desmethylclozapine and clozapine N-oxide, were elevated about 3-fold compared to baseline steady-state concentrations","ncit:positive","ncit:quantitative","clozapine","http://dbmi-icode-01.dbmi.pitt.edu:2020/vocab/resource/active-ingredient","dikbD2R:object-drug-of-interaction","UNK","fluvoxamine","http://dbmi-icode-01.dbmi.pitt.edu:2020/vocab/resource/active-ingredient","dikbD2R:precipitant-drug-of-interaction","UNK","UNK","Oral","UNK","UNK","Oral","14","16","UNK","UNK","UNK","UNK","UNK","UNK","UNK","UNK","UNK","UNK","UNK","UNK"
"http://dbmi-icode-01.dbmi.pitt.edu:80/DDI-labels/7b8e5b26-b9e4-4704-921b-3c3c0d159916.html","2015-11-29 16:18:02 -0700","DDI-clinical-trial","evidence-supports","Co-administration of INVEGA® 6 mg once daily with carbamazepine, a strong inducer of both CYP3A4 and P-glycoprotein (P-gp), at 200 mg twice daily caused a decrease of approximately 37% in the mean steady-state Cmax and AUC of paliperidone. This decrease is caused, to a substantial degree, by a 35% increase in renal clearance of paliperidone. A minor decrease in the amount of drug excreted unchanged in the urine suggests that there was little effect on the CYP metabolism or bioavailability of paliperidone during carbamazepine co-administration.","ncit:positive","ncit:quantitative","carbamazepine","http://dbmi-icode-01.dbmi.pitt.edu:2020/vocab/resource/active-ingredient","dikbD2R:precipitant-drug-of-interaction","200","INVEGA","http://dbmi-icode-01.dbmi.pitt.edu:2020/vocab/resource/active-ingredient","dikbD2R:object-drug-of-interaction","6","QD","Oral","UNK","BID","Oral","UNK","UNK","37","Percent","Decrease","35","Percent","Increase","37","Percent","Increase","UNK","UNK","UNK"
"http://dbmi-icode-01.dbmi.pitt.edu:80/DDI-labels/51ff7db5-aaf9-4c3c-86e6-958ebf16b60f.html","2015-11-29 10:40:46 -0800","DDI-clinical-trial","evidence-challenges","Desipramine – When nefazodone (150 mg BID) and desipramine (75 mg QD) were administered together there were no changes in the pharmacokinetics of desipramine or its metabolite, 2-hydroxy desipramine. ","ncit:negative","ncit:quantitative","nefazodone","http://dbmi-icode-01.dbmi.pitt.edu:2020/vocab/resource/active-ingredient","dikbD2R:precipitant-drug-of-interaction","150","Desipramine","http://dbmi-icode-01.dbmi.pitt.edu:2020/vocab/resource/active-ingredient","dikbD2R:object-drug-of-interaction","75","QD","Oral","UNK","BID","Oral","UNK","UNK","UNK","UNK","UNK","UNK","UNK","UNK","UNK","UNK","UNK","UNK","UNK","UNK"
"http://dbmi-icode-01.dbmi.pitt.edu:80/DDI-labels/4b0700c9-b417-4c3a-b36f-de461e125bd3.html","2015-11-29 13:38:00 -0700","DDI-clinical-trial","evidence-challenges","Multiple doses of BRINTELLIX did not affect the pharmacokinetics or pharmacodynamics (composite cognitive score) of diazepam.","ncit:negative","ncit:quantitative","diazepam","http://dbmi-icode-01.dbmi.pitt.edu:2020/vocab/resource/active-ingredient","dikbD2R:object-drug-of-interaction","UNK","BRINTELLIX","http://dbmi-icode-01.dbmi.pitt.edu:2020/vocab/resource/active-ingredient","dikbD2R:precipitant-drug-of-interaction","UNK","UNK","Oral","UNK","UNK","Oral","UNK","UNK","UNK","UNK","UNK","UNK","UNK","UNK","UNK","UNK","UNK","UNK","UNK","UNK"
"http://dbmi-icode-01.dbmi.pitt.edu:80/DDI-labels/51ff7db5-aaf9-4c3c-86e6-958ebf16b60f.html","2015-11-27 13:03:19 -0800","DDI-clinical-trial","evidence-challenges","Nefazodone plasma concentrations were unaffected by triazolam.","ncit:negative","ncit:quantitative","Nefazodone","http://dbmi-icode-01.dbmi.pitt.edu:2020/vocab/resource/active-ingredient","dikbD2R:object-drug-of-interaction","200","triazolam","http://dbmi-icode-01.dbmi.pitt.edu:2020/vocab/resource/active-ingredient","dikbD2R:precipitant-drug-of-interaction",".25","BID","Oral","UNK","SD","Oral","1","UNK","UNK","UNK","UNK","UNK","UNK","UNK","UNK","UNK","UNK","UNK","UNK","UNK"
"http://dbmi-icode-01.dbmi.pitt.edu:80/DDI-labels/036db1f2-52b3-42a0-acf9-817b7ba8c724.html","2015-12-08 19:04:34 -0700","DDI-clinical-trial","evidence-challenges","Population pharmacokinetic analysis of schizophrenic patients enrolled in controlled clinical trials has not revealed evidence of any clinically significant pharmacokinetic interactions with benztropine, propranolol, or lorazepam.         The absolute bioavailability of a 20 mg dose under fed conditions is approximately 60%. The absorption of ziprasidone is increased up to two-fold in the presence of food","ncit:negative","ncit:quantitative","benztropine","http://dbmi-icode-01.dbmi.pitt.edu:2020/vocab/resource/active-ingredient","dikbD2R:object-drug-of-interaction","UNK","ziprasidone","http://dbmi-icode-01.dbmi.pitt.edu:2020/vocab/resource/active-ingredient","dikbD2R:precipitant-drug-of-interaction","UNK","UNK","Oral","UNK","UNK","Oral","UNK","UNK","UNK","UNK","UNK","UNK","UNK","UNK","UNK","UNK","UNK","UNK","UNK","UNK"
"http://dbmi-icode-01.dbmi.pitt.edu:80/DDI-labels/51ff7db5-aaf9-4c3c-86e6-958ebf16b60f.html","2015-11-29 11:05:41 -0800","DDI-clinical-trial","evidence-challenges","When nefazodone (200 mg BID) and cimetidine (300 mg QID) were coadministered for one week, no change in the steady-state pharmacokinetics of either nefazodone or cimetidine was observed compared to each dosed alone. Therefore, dosage adjustment is not necessary for either drug when coadministered.","ncit:negative","ncit:quantitative","cimetidine","http://dbmi-icode-01.dbmi.pitt.edu:2020/vocab/resource/active-ingredient","dikbD2R:object-drug-of-interaction","300","nefazodone","http://dbmi-icode-01.dbmi.pitt.edu:2020/vocab/resource/active-ingredient","dikbD2R:precipitant-drug-of-interaction","200","QID","Oral","7","BID","Oral","7","UNK","UNK","UNK","UNK","UNK","UNK","UNK","UNK","UNK","UNK","UNK","UNK","UNK"
"http://dbmi-icode-01.dbmi.pitt.edu:80/DDI-labels/49c4105b-e518-481c-a248-6684135f5bc1.html","2015-11-29 16:36:20 -0700","DDI-clinical-trial","evidence-challenges","Repeated oral doses of risperidone (3 mg twice daily) did not affect the exposure (AUC) or peak plasma concentrations (Cmax) of lithium (n=13). Dose adjustment for lithium is not recommended.","ncit:negative","ncit:quantitative","lithium","http://dbmi-icode-01.dbmi.pitt.edu:2020/vocab/resource/active-ingredient","dikbD2R:object-drug-of-interaction","UNK","risperidone","http://dbmi-icode-01.dbmi.pitt.edu:2020/vocab/resource/active-ingredient","dikbD2R:precipitant-drug-of-interaction","3","UNK","Oral","UNK","BID","Oral","UNK","13","UNK","UNK","UNK","UNK","UNK","UNK","UNK","UNK","UNK","UNK","UNK","UNK"
"http://dbmi-icode-01.dbmi.pitt.edu:80/DDI-labels/d5051fbc-846b-4946-82df-341fb1216341.html","2016-02-16 12:37:44 -0700","DDI-clinical-trial","evidence-supports","Fluoxetine (60 mg single dose or 60 mg daily dose for 8 days) causes a small (mean 16%) increase in the maximum concentration of olanzapine and a small (mean 16%) decrease in olanzapine clearance","ncit:positive","ncit:quantitative","Fluoxetine","http://dbmi-icode-01.dbmi.pitt.edu:2020/vocab/resource/active-ingredient","dikbD2R:precipitant-drug-of-interaction","60","olanzapine","http://dbmi-icode-01.dbmi.pitt.edu:2020/vocab/resource/active-ingredient","dikbD2R:object-drug-of-interaction","UNK","UNK","Oral","UNK","QD","Oral","8","UNK","UNKUNK","UNK","UNK","16","Percent","Decrease","16","Percent","Increase","UNK","UNK","UNK"
"http://dbmi-icode-01.dbmi.pitt.edu:80/DDI-labels/51ff7db5-aaf9-4c3c-86e6-958ebf16b60f.html","2015-11-27 13:57:09 -0800","DDI-clinical-trial","evidence-supports","Buspirone – In a study of steady-state pharmacokinetics in healthy volunteers, coadministration of buspirone (2.5 or 5 mg BID) with nefazodone (250 mg BID) resulted in marked increases in plasma buspirone concentrations (increases up to 20 fold in Cmax and up to 50 fold in AUC) and statistically significant decreases (about 50%) in plasma concentrations of the buspirone metabolite 1-pyrimidinylpiperazine.","ncit:positive","ncit:quantitative","nefazodone","http://dbmi-icode-01.dbmi.pitt.edu:2020/vocab/resource/active-ingredient","dikbD2R:precipitant-drug-of-interaction","250","1-pyrimidinylpiperazine.","http://dbmi-icode-01.dbmi.pitt.edu:2020/vocab/resource/metabolite","dikbD2R:object-drug-of-interaction","2.5 or 5","BID","Oral","UNK","BID","Oral","UNK","UNK","about 50","Percent","Decrease","UNK","UNK","UNK","UNK","UNK","UNK","UNK","UNK","UNK"
"http://dbmi-icode-01.dbmi.pitt.edu:80/DDI-labels/51ff7db5-aaf9-4c3c-86e6-958ebf16b60f.html","2015-11-27 14:24:30 -0800","DDI-clinical-trial","evidence-challenges"," When fluoxetine (20 mg QD) and nefazodone (200 mg BID) were administered at steady state there were no changes in the pharmacokinetic parameters for fluoxetine or its metabolite, norfluoxetine.","ncit:negative","ncit:quantitative","fluoxetine","http://dbmi-icode-01.dbmi.pitt.edu:2020/vocab/resource/active-ingredient","dikbD2R:object-drug-of-interaction","20","nefazodone","http://dbmi-icode-01.dbmi.pitt.edu:2020/vocab/resource/active-ingredient","dikbD2R:precipitant-drug-of-interaction","200","QD","Oral","UNK","BID","Oral","UNK","UNK","UNK","UNK","UNK","UNK","UNK","UNK","UNK","UNK","UNK","UNK","UNK","UNK"
"http://dbmi-icode-01.dbmi.pitt.edu:80/DDI-labels/d5051fbc-846b-4946-82df-341fb1216341.html","2016-02-16 16:22:18 -0700","DDI-clinical-trial","evidence-challenges","Single doses of olanzapine did not affect the pharmacokinetics of warfarin ","ncit:negative","ncit:quantitative","warfarin","http://dbmi-icode-01.dbmi.pitt.edu:2020/vocab/resource/active-ingredient","dikbD2R:object-drug-of-interaction","UNK","olanzapine","http://dbmi-icode-01.dbmi.pitt.edu:2020/vocab/resource/active-ingredient","dikbD2R:precipitant-drug-of-interaction","UNK","UNK","Oral","UNK","SD","Oral","1","UNK","UNK","UNK","UNK","UNK","UNK","UNK","UNK","UNK","UNK","UNK","UNK","UNK"
"http://dbmi-icode-01.dbmi.pitt.edu:80/DDI-labels/9c4bedb4-2d59-4fcd-aad7-fce988cd96d8.html","2016-02-29 14:20:40 -0700","drug-drug-interaction","evidence-supports","Reduced cytochrome P450 2D6 isozyme activity drugs that inhibit this isozyme (e.g., fluoxetine and paroxetine) and certain other drugs (e.g., fluvoxamine, propranolol, and pindolol) appear to appreciably inhibit the metabolism of thioridazine. The resulting elevated levels of thioridazine would be expected to augment the prolongation of the QTc interval associated with thioridazine and may increase the risk of serious, potentially fatal, cardiac arrhythmias, such as Torsades de pointes type arrhythmias.","ncit:positive","ncit:Qualitative","thioridazine","http://dbmi-icode-01.dbmi.pitt.edu:2020/vocab/resource/active-ingredient","dikbD2R:object-drug-of-interaction","nodeID://b36609","fluvoxamine","http://dbmi-icode-01.dbmi.pitt.edu:2020/vocab/resource/active-ingredient","dikbD2R:precipitant-drug-of-interaction",,,,,,,,,,,,,,,,,,,,
"http://dbmi-icode-01.dbmi.pitt.edu:80/DDI-labels/5f0c6f5f-b906-4c8f-8580-3939a476a1c1.html","2016-01-11 10:38:01 -0700","drug-drug-interaction","evidence-supports","Concomitant use of CLOZARIL and CYP1A2 inhibitors can increase plasma levels of clozapine, potentially resulting in adverse reactions. Reduce the CLOZARIL dose to one-third of the original dose when CLOZARIL is coadministered with strong CYP1A2 inhibitors (e.g., fluvoxamine, ciprofloxacin, or enoxacin). The CLOZARIL dose should be increased to the original dose when coadministration of strong CYP1A2 inhibitors is discontinued [see Dosage and Administration (2.6), Clinical Pharmacology (12.3)].","ncit:positive","ncit:Qualitative","enoxacin","http://dbmi-icode-01.dbmi.pitt.edu:2020/vocab/resource/active-ingredient","dikbD2R:precipitant-drug-of-interaction",,"clozapine","http://dbmi-icode-01.dbmi.pitt.edu:2020/vocab/resource/active-ingredient","dikbD2R:object-drug-of-interaction","nodeID://b35786",,,,,,,,,,,,,,,,,,,
"http://dbmi-icode-01.dbmi.pitt.edu:80/DDI-labels/4b0700c9-b417-4c3a-b36f-de461e125bd3.html","2015-11-29 13:52:49 -0700","DDI-clinical-trial","evidence-challenges","Furthermore, in a series of clinical drug interaction studies, coadministration of BRINTELLIX with substrates for CYP2B6 (e.g., bupropion), CYP2C9 (e.g., warfarin), and CYP2C19 (e.g., diazepam), had no clinical meaningful effect on the pharmacokinetics of these substrates (Figure 2).","ncit:negative","ncit:quantitative","bupropion","http://dbmi-icode-01.dbmi.pitt.edu:2020/vocab/resource/active-ingredient","dikbD2R:object-drug-of-interaction","UNK","BRINTELLIX","http://dbmi-icode-01.dbmi.pitt.edu:2020/vocab/resource/active-ingredient","dikbD2R:precipitant-drug-of-interaction","UNK","UNK","Oral","UNK","UNK","Oral","UNK","UNK","UNK","UNK","UNK","UNK","UNK","UNK","UNK","UNK","UNK","UNK","UNK","UNK"
"http://dbmi-icode-01.dbmi.pitt.edu:80/DDI-labels/5f0c6f5f-b906-4c8f-8580-3939a476a1c1.html","2016-01-11 10:36:49 -0700","drug-drug-interaction","evidence-supports","oncomitant use of CLOZARIL and CYP1A2 inhibitors can increase plasma levels of clozapine, potentially resulting in adverse reactions. Reduce the CLOZARIL dose to one-third of the original dose when CLOZARIL is coadministered with strong CYP1A2 inhibitors (e.g., fluvoxamine, ciprofloxacin, or enoxacin). The CLOZARIL dose should be increased to the original dose when coadministration of strong CYP1A2 inhibitors is discontinued [see Dosage and Administration (2.6), Clinical Pharmacology (12.3)].","ncit:positive","ncit:Qualitative","clozapine","http://dbmi-icode-01.dbmi.pitt.edu:2020/vocab/resource/active-ingredient","dikbD2R:object-drug-of-interaction","nodeID://b32838","fluvoxamine","http://dbmi-icode-01.dbmi.pitt.edu:2020/vocab/resource/active-ingredient","dikbD2R:precipitant-drug-of-interaction",,,,,,,,,,,,,,,,,,,,
"http://dbmi-icode-01.dbmi.pitt.edu:80/DDI-labels/51ff7db5-aaf9-4c3c-86e6-958ebf16b60f.html","2015-11-27 13:33:28 -0800","DDI-clinical-trial","evidence-challenges","Lorazepam – When lorazepam (2 mg BID) and nefazodone (200 mg BID) were coadministered to steady state, there was no change in any pharmacokinetic parameter for either drug compared to each drug administered alone. Therefore, dosage adjustment is not necessary for either drug when coadministered.","ncit:negative","ncit:quantitative","nefazodone","http://dbmi-icode-01.dbmi.pitt.edu:2020/vocab/resource/active-ingredient","dikbD2R:object-drug-of-interaction","200","Lorazepam","http://dbmi-icode-01.dbmi.pitt.edu:2020/vocab/resource/active-ingredient","dikbD2R:precipitant-drug-of-interaction","2","BID","Oral","UNK","BID","Oral","UNK","UNK","UNKUNK","UNK","UNK","UNK","UNK","UNK","UNK","UNK","UNK","UNK","UNK","UNK"
"http://dbmi-icode-01.dbmi.pitt.edu:80/DDI-labels/036db1f2-52b3-42a0-acf9-817b7ba8c724.html","2015-12-08 19:05:25 -0700","DDI-clinical-trial","evidence-challenges","Population pharmacokinetic analysis of schizophrenic patients enrolled in controlled clinical trials has not revealed evidence of any clinically significant pharmacokinetic interactions with benztropine, propranolol, or lorazepam.         The absolute bioavailability of a 20 mg dose under fed conditions is approximately 60%. The absorption of ziprasidone is increased up to two-fold in the presence of food","ncit:negative","ncit:quantitative","ziprasidone","http://dbmi-icode-01.dbmi.pitt.edu:2020/vocab/resource/active-ingredient","dikbD2R:precipitant-drug-of-interaction","UNK","lorazepam","http://dbmi-icode-01.dbmi.pitt.edu:2020/vocab/resource/active-ingredient","dikbD2R:object-drug-of-interaction","UNK","UNK","Oral","UNK","UNK","Oral","UNK","UNK","UNK","UNK","UNK","UNK","UNK","UNK","UNK","UNK","UNK","UNK","UNK","UNK"
"http://dbmi-icode-01.dbmi.pitt.edu:80/DDI-labels/43452bf8-76e7-47a9-a5d8-41fe84d061f0.html","2015-11-29 14:55:02 -0700","DDI-clinical-trial","evidence-supports","Paroxetine: Co-administration of paroxetine (20 mg/day for 5 to 8 days), a potent inhibitor of CYP2D6, with multiple doses of iloperidone (8 or 12 mg twice daily) to patients with schizophrenia ages 18 to 65 years resulted in increased mean steady-state peak concentrations of iloperidone and its metabolite P88, by about 1.6-fold, and decreased mean steady-state peak concentrations of its metabolite P95 by one-half. Iloperidone doses should be reduced by one-half when administered with paroxetine. ","ncit:positive","ncit:quantitative","P95","http://dbmi-icode-01.dbmi.pitt.edu:2020/vocab/resource/metabolite","dikbD2R:object-drug-of-interaction","8 or 12","paroxetine","http://dbmi-icode-01.dbmi.pitt.edu:2020/vocab/resource/active-ingredient","dikbD2R:precipitant-drug-of-interaction","20","BID","Oral","UNK","Daily","Oral","5 to 8","UNK","UNK","UNK","UNK","UNK","UNK","UNK","50","Percent","Decrease","UNK","UNK","UNK"
"http://dbmi-icode-01.dbmi.pitt.edu:80/DDI-labels/51ff7db5-aaf9-4c3c-86e6-958ebf16b60f.html","2015-11-27 14:01:56 -0800","DDI-clinical-trial","evidence-supports","With 5 mg BID doses of buspirone, slight increases in AUC were observed for nefazodone (23%) and its metabolites hydroxynefazodone (17%) and mCPP (9%).","ncit:positive","ncit:quantitative","buspirone","http://dbmi-icode-01.dbmi.pitt.edu:2020/vocab/resource/active-ingredient","dikbD2R:precipitant-drug-of-interaction","5","nefazodone","http://dbmi-icode-01.dbmi.pitt.edu:2020/vocab/resource/active-ingredient","dikbD2R:object-drug-of-interaction","250","BID","Oral","UNK","BID","Oral","UNK","UNK","23","Percent","Increase","UNK","UNK","UNK","UNK","UNK","UNK","UNK","UNK","UNK"
"http://dbmi-icode-01.dbmi.pitt.edu:80/DDI-labels/43452bf8-76e7-47a9-a5d8-41fe84d061f0.html","2015-11-29 14:46:00 -0700","DDI-clinical-trial","evidence-supports","Fluoxetine: Co-administration of fluoxetine (20 mg twice daily for 21 days), a potent inhibitor of CYP2D6, with a single 3 mg dose of iloperidone to 23 healthy volunteers, ages 29 to 44 years, who were classified as CYP2D6 extensive metabolizers, increased the AUC of iloperidone and its metabolite P88, by about 2- to 3-fold, and decreased the AUC of its metabolite P95 by one-half. Iloperidone doses should be reduced by one-half when administered with fluoxetine. ","ncit:positive","ncit:quantitative","fluoxetine","http://dbmi-icode-01.dbmi.pitt.edu:2020/vocab/resource/active-ingredient","dikbD2R:precipitant-drug-of-interaction","20","iloperidone","http://dbmi-icode-01.dbmi.pitt.edu:2020/vocab/resource/active-ingredient","dikbD2R:object-drug-of-interaction","3","SD","Oral","1","BID","Oral","21","23","2 to 3","Fold","Increase","UNK","UNK","UNK","UNK","UNK","UNK","UNK","UNK","UNK"
"http://dbmi-icode-01.dbmi.pitt.edu:80/DDI-labels/d5051fbc-846b-4946-82df-341fb1216341.html","2016-02-16 12:34:19 -0700","drug-drug-interaction","evidence-challenges","Single doses of cimetidine (800 mg) or aluminum- and magnesium-containing antacids did not affect the oral bioavailability of olanzapine. ","ncit:negative","ncit:Qualitative","olanzapine","http://dbmi-icode-01.dbmi.pitt.edu:2020/vocab/resource/active-ingredient","dikbD2R:object-drug-of-interaction","nodeID://b31422","cimetidine","http://dbmi-icode-01.dbmi.pitt.edu:2020/vocab/resource/active-ingredient","dikbD2R:precipitant-drug-of-interaction",,,,,,,,,,,,,,,,,,,,
"http://dbmi-icode-01.dbmi.pitt.edu:80/DDI-labels/4e1e5249-1cb7-4cc2-ad5a-cdeeee2f494f.html","2016-02-16 18:57:43 -0500","DDI-clinical-trial","evidence-supports","Coadministration of quetiapine and phenytoin, a CYP3A4 inducer increased the mean oral clearance of quetiapine by 5-fold.","ncit:positive","ncit:quantitative","quetiapine","http://dbmi-icode-01.dbmi.pitt.edu:2020/vocab/resource/active-ingredient","dikbD2R:object-drug-of-interaction","UNK","phenytoin","http://dbmi-icode-01.dbmi.pitt.edu:2020/vocab/resource/active-ingredient","dikbD2R:precipitant-drug-of-interaction","UNK","UNK","Oral","UNK","UNK","Oral","UNK","UNK","UNK","UNK","UNK","5","Fold","Increase","UNK","UNK","UNK","UNK","UNK","UNK"
"http://dbmi-icode-01.dbmi.pitt.edu:80/DDI-labels/4b0700c9-b417-4c3a-b36f-de461e125bd3.html","2015-11-29 13:57:37 -0700","DDI-clinical-trial","evidence-challenges","Furthermore, in a series of clinical drug interaction studies, coadministration of BRINTELLIX with substrates for CYP2B6 (e.g., bupropion), CYP2C9 (e.g., warfarin), and CYP2C19 (e.g., diazepam), had no clinical meaningful effect on the pharmacokinetics of these substrates (Figure 2).","ncit:negative","ncit:quantitative","BRINTELLIX","http://dbmi-icode-01.dbmi.pitt.edu:2020/vocab/resource/active-ingredient","dikbD2R:precipitant-drug-of-interaction","UNK","warfarin","http://dbmi-icode-01.dbmi.pitt.edu:2020/vocab/resource/active-ingredient","dikbD2R:object-drug-of-interaction","UNK","UNK","Oral","UNK","UNK","Oral","UNK","UNK","UNK","UNK","UNK","UNK","UNK","UNK","UNK","UNK","UNK","UNK","UNK","UNK"
"http://dbmi-icode-01.dbmi.pitt.edu:80/DDI-labels/4b0700c9-b417-4c3a-b36f-de461e125bd3.html","2015-11-29 13:57:37 -0700","DDI-clinical-trial","evidence-challenges","Furthermore, in a series of clinical drug interaction studies, coadministration of BRINTELLIX with substrates for CYP2B6 (e.g., bupropion), CYP2C9 (e.g., warfarin), and CYP2C19 (e.g., diazepam), had no clinical meaningful effect on the pharmacokinetics of these substrates (Figure 2)","ncit:negative","ncit:quantitative","diazepam","http://dbmi-icode-01.dbmi.pitt.edu:2020/vocab/resource/active-ingredient","dikbD2R:object-drug-of-interaction","UNK","BRINTELLIX","http://dbmi-icode-01.dbmi.pitt.edu:2020/vocab/resource/active-ingredient","dikbD2R:precipitant-drug-of-interaction","UNK","UNK","Oral","UNK","UNK","Oral","UNK","UNK","UNK","UNK","UNK","UNK","UNK","UNK","UNK","UNK","UNK","UNK","UNK","UNK"
