"source","date","assertionType","evidenceType","exactText","modality","statementType","drug1Lab","drug1Type","drug1Role","dose1","drug2Lab","drug2Type","drug2Role","dose2","objectRegimens","objectFormulation","objectDuration","preciptRegimens","preciptFormulation","preciptDuration","numOfParticipants","auc","aucType","aucDirection","cl","clType","clDirection","cmax","cmaxType","cmaxDirection","t12","t12Type","t12Direction"
"http://dbmi-icode-01.dbmi.pitt.edu:80/DDI-labels/1a5a93be-7bc3-4714-9308-2fbfb8260e23.html","2016-02-29 15:03:48 -0700","drug-drug-interaction","evidence-supports","Concomitant administration of propranolol with phenothiazines results in increased plasma levels of both drugs.","ncit:positive","ncit:Qualitative","propranolol","http://dbmi-icode-01.dbmi.pitt.edu:2020/vocab/resource/active-ingredient","dikbD2R:precipitant-drug-of-interaction",,"phenothiazines","http://dbmi-icode-01.dbmi.pitt.edu:2020/vocab/resource/active-ingredient","dikbD2R:object-drug-of-interaction","nodeID://b36365",,,,,,,,,,,,,,,,,,,
"http://dbmi-icode-01.dbmi.pitt.edu:80/DDI-labels/51ff7db5-aaf9-4c3c-86e6-958ebf16b60f.html","2015-11-27 13:01:39 -0800","DDI-clinical-trial","evidence-supports","When a single oral 0.25 mg dose of triazolam was coadministered with nefazodone (200 mg BID) at steady state, triazolam half-life and AUC increased 4 fold and peak concentrations increased 1.7 fold. ","ncit:positive","ncit:quantitative","nefazodone","http://dbmi-icode-01.dbmi.pitt.edu:2020/vocab/resource/active-ingredient","dikbD2R:precipitant-drug-of-interaction","200","triazolam","http://dbmi-icode-01.dbmi.pitt.edu:2020/vocab/resource/active-ingredient","dikbD2R:object-drug-of-interaction",".25","SD","Oral","1","BID","Oral","UNK","UNK","4","Fold","Increase","UNK","UNK","UNK","1.7","Fold","Increase","4","Fold","Increase"
"http://dbmi-icode-01.dbmi.pitt.edu:80/DDI-labels/43452bf8-76e7-47a9-a5d8-41fe84d061f0.html","2015-11-29 14:35:23 -0700","DDI-clinical-trial","evidence-supports","Ketoconazole: Co-administration of ketoconazole (200 mg twice daily for 4 days), a potent inhibitor of CYP3A4, with a 3 mg single dose of iloperidone to 19 healthy volunteers, ages 18 to 45 years, increased the area under the curve (AUC) of iloperidone and its metabolites P88 and P95 by 57%, 55% and 35%, respectively. Iloperidone doses should be reduced by about one-half when administered with ketoconazole or other strong inhibitors of CYP3A4 (e.g., itraconazole). Weaker inhibitors (e.g., erythromycin, grapefruit juice) have not been studied. When the CYP3A4 inhibitor is withdrawn from the combination therapy, the iloperidone dose should be returned to the previous level.","ncit:positive","ncit:quantitative","ketoconazole","http://dbmi-icode-01.dbmi.pitt.edu:2020/vocab/resource/active-ingredient","dikbD2R:precipitant-drug-of-interaction","200","iloperidone","http://dbmi-icode-01.dbmi.pitt.edu:2020/vocab/resource/active-ingredient","dikbD2R:object-drug-of-interaction","3","SD","Oral","1","BID","Oral","4","19","57","Percent","Increase","UNK","UNK","UNK","UNK","UNK","UNK","UNK","UNK","UNK"
"http://dbmi-icode-01.dbmi.pitt.edu:80/DDI-labels/d78e9639-6fab-4a78-8b29-6991a18ae6c6.html","2016-02-19 17:46:51 -0500","drug-drug-interaction","evidence-supports","In one study of 45 elderly patients suffering from dementia treated with perphenazine, the 5 patients who were prospectively identified as poor P450 2D6 metabolizers had reported significantly greater side effects during the first 10 days of treatment than the 40 extensive metabolizers, following which the groups tended to converge. Prospective phenotyping of elderly patients prior to antipsychotic treatment may identify those at risk for adverse events.    The concomitant administration of other drugs that inhibit the activity of P450 2D6 may acutely increase plasma concentrations of antipsychotics. Among these are tricyclic antidepressants and selective serotonin reuptake inhibitors, e.g., fluoxetine, sertraline and paroxetine. When prescribing these drugs to patients already receiving antipsychotic therapy, close monitoring is essential and dose reduction may become necessary to avoid toxicity. Lower doses than usually prescribed for either the antipsychotic or the other drug may be required.","ncit:positive","ncit:Qualitative","paroxetine","http://dbmi-icode-01.dbmi.pitt.edu:2020/vocab/resource/active-ingredient","dikbD2R:precipitant-drug-of-interaction",,"perphenazine","http://dbmi-icode-01.dbmi.pitt.edu:2020/vocab/resource/active-ingredient","dikbD2R:object-drug-of-interaction","nodeID://b35375",,,,,,,,,,,,,,,,,,,
"http://dbmi-icode-01.dbmi.pitt.edu:80/DDI-labels/9c4bedb4-2d59-4fcd-aad7-fce988cd96d8.html","2016-02-29 14:37:32 -0700","DDI-clinical-trial","evidence-supports","The effect of fluvoxamine (25 mg b.i.d. for one week) on thioridazine steady-state concentration was evaluated in ten male inpatients with schizophrenia. Concentrations of thioridazine and its two active metabolites, mesoridazine and sulforidazine, increased 3-fold following coadministration of fluvoxamine. Fluvoxamine and thioridazine should not be coadministered.","ncit:positive","ncit:quantitative","sulforidazine","http://dbmi-icode-01.dbmi.pitt.edu:2020/vocab/resource/metabolite","dikbD2R:object-drug-of-interaction","UNK","Fluvoxamine","http://dbmi-icode-01.dbmi.pitt.edu:2020/vocab/resource/active-ingredient","dikbD2R:precipitant-drug-of-interaction","25","UNK","Oral","UNK","BID","Oral","7","10","3","Fold","Increase","UNK","UNK","UNK","UNK","UNK","UNK","UNK","UNK","UNK"
"http://dbmi-icode-01.dbmi.pitt.edu:80/DDI-labels/43452bf8-76e7-47a9-a5d8-41fe84d061f0.html","2015-11-29 15:12:19 -0700","DDI-clinical-trial","evidence-supports","Dextromethorphan: A study in healthy volunteers showed that changes in the pharmacokinetics of dextromethorphan (80 mg dose) when a 3 mg dose of iloperidone was co-administered resulted in a 17% increase in total exposure and a 26% increase in the maximum plasma concentrations (Cmax)of dextromethorphan. Thus, an interaction between iloperidone and other CYP2D6 substrates is unlikely.","ncit:positive","ncit:quantitative","dextromethorphan","http://dbmi-icode-01.dbmi.pitt.edu:2020/vocab/resource/active-ingredient","dikbD2R:object-drug-of-interaction","80","iloperidone","http://dbmi-icode-01.dbmi.pitt.edu:2020/vocab/resource/active-ingredient","dikbD2R:precipitant-drug-of-interaction","3","SD","Oral","1","SD","Oral","1","UNK","17","Percent","Increase","UNK","UNK","UNK","26","Percent","Increase","UNK","UNK","UNK"
"http://dbmi-icode-01.dbmi.pitt.edu:80/DDI-labels/51ff7db5-aaf9-4c3c-86e6-958ebf16b60f.html","2015-11-29 10:37:19 -0800","DDI-clinical-trial","evidence-challenges","Phenytoin – Pretreatment for 7 days with 200 mg BID of nefazodone had no effect on the pharmacokinetics of a single 300 mg oral dose of phenytoin. However, due to the nonlinear pharmacokinetics of phenytoin, the failure to observe a significant effect on the single-dose pharmacokinetics of phenytoin does not preclude the possibility of a clinically significant interaction with nefazodone when phenytoin is dosed chronically. ","ncit:negative","ncit:quantitative","nefazodone","http://dbmi-icode-01.dbmi.pitt.edu:2020/vocab/resource/active-ingredient","dikbD2R:precipitant-drug-of-interaction","200","Phenytoin","http://dbmi-icode-01.dbmi.pitt.edu:2020/vocab/resource/active-ingredient","dikbD2R:object-drug-of-interaction","300","SD","Oral","1","BID","Oral","7","UNK","UNK","UNK","UNK","UNK","UNK","UNK","UNK","UNK","UNK","UNK","UNK","UNK"
"http://dbmi-icode-01.dbmi.pitt.edu:80/DDI-labels/5f0c6f5f-b906-4c8f-8580-3939a476a1c1.html","2016-02-18 16:49:30 -0700","DDI-clinical-trial","evidence-supports","A pharmacokinetic study was conducted in 16 schizophrenic patients who received clozapine under steady-state conditions. After coadministration of fluvoxamine for 14 days, mean trough concentrations of clozapine and its metabolites, N-desmethylclozapine and clozapine N-oxide, were elevated about 3-fold compared to baseline steady-state concentrations.","ncit:positive","ncit:quantitative","clozapine N-oxide","http://dbmi-icode-01.dbmi.pitt.edu:2020/vocab/resource/metabolite","dikbD2R:object-drug-of-interaction","UNK","fluvoxamine","http://dbmi-icode-01.dbmi.pitt.edu:2020/vocab/resource/active-ingredient","dikbD2R:precipitant-drug-of-interaction","UNK","UNK","Oral","UNK","UNK","Oral","14","16","UNK","UNK","UNK","UNK","UNK","UNK","UNK","UNK","UNK","UNK","UNK","UNK"
"http://dbmi-icode-01.dbmi.pitt.edu:80/DDI-labels/51ff7db5-aaf9-4c3c-86e6-958ebf16b60f.html","2015-11-27 13:29:38 -0800","DDI-clinical-trial","evidence-challenges","Lorazepam – When lorazepam (2 mg BID) and nefazodone (200 mg BID) were coadministered to steady state, there was no change in any pharmacokinetic parameter for either drug compared to each drug administered alone. Therefore, dosage adjustment is not necessary for either drug when coadministered.","ncit:negative","ncit:quantitative","Lorazepam","http://dbmi-icode-01.dbmi.pitt.edu:2020/vocab/resource/active-ingredient","dikbD2R:object-drug-of-interaction","5","nefazodone","http://dbmi-icode-01.dbmi.pitt.edu:2020/vocab/resource/active-ingredient","dikbD2R:precipitant-drug-of-interaction","200","SD","Oral","1","BID","Oral","UNK","UNK","UNK","UNK","UNK","UNK","UNK","UNK","UNK","UNK","UNK","UNK","UNK","UNK"
"http://dbmi-icode-01.dbmi.pitt.edu:80/DDI-labels/4e1e5249-1cb7-4cc2-ad5a-cdeeee2f494f.html","2016-02-16 16:34:55 -0700","drug-drug-interaction","evidence-supports","Quetiapine exposure is increased by the prototype CYP3A4 inhibitors (e.g., ketoconazole, itraconazole, indinavir, ritonavir, nefazodone, etc.)","ncit:positive","ncit:Qualitative","indinavir","http://dbmi-icode-01.dbmi.pitt.edu:2020/vocab/resource/active-ingredient","dikbD2R:precipitant-drug-of-interaction",,"Quetiapine","http://dbmi-icode-01.dbmi.pitt.edu:2020/vocab/resource/active-ingredient","dikbD2R:object-drug-of-interaction","nodeID://b36222",,,,,,,,,,,,,,,,,,,
"http://dbmi-icode-01.dbmi.pitt.edu:80/DDI-labels/4b0700c9-b417-4c3a-b36f-de461e125bd3.html","2015-11-29 13:52:49 -0700","DDI-clinical-trial","evidence-challenges","Coadministration of aspirin 150 mg/day with multiple daily doses of BRINTELLIX had no significant inhibitory effect on platelet aggregation or pharmacokinetics of aspirin and salicylic acid [see Drug Interactions (7.4)].","ncit:negative","ncit:quantitative","salicylic acid","http://dbmi-icode-01.dbmi.pitt.edu:2020/vocab/resource/metabolite","dikbD2R:object-drug-of-interaction","150","BRINTELLIX","http://dbmi-icode-01.dbmi.pitt.edu:2020/vocab/resource/active-ingredient","dikbD2R:precipitant-drug-of-interaction","UNK","Daily","Oral","UNK","UNK","UNK","UNK","UNK","UNK","UNK","UNK","UNKUNUNK","UNK","UNK","UNK","UNK","UNK","UNK","UNK","UNK"
"http://dbmi-icode-01.dbmi.pitt.edu:80/DDI-labels/afad3051-9df2-4c54-9684-e8262a133af8.html","2015-12-08 19:35:35 -0700","DDI-clinical-trial","evidence-challenges","Valproate: It is not necessary to adjust the LATUDA dose when used concomitantly with valproate. A dedicated drug-drug interaction study has not been conducted with valproate and LATUDA. Based on pharmacokinetic data from the bipolar depression studies valproate levels were not affected by lurasidone, and lurasidone concentrations were not affected by valproate. ","ncit:negative","ncit:quantitative","lurasidone","http://dbmi-icode-01.dbmi.pitt.edu:2020/vocab/resource/active-ingredient","dikbD2R:object-drug-of-interaction","UNK","valproate","http://dbmi-icode-01.dbmi.pitt.edu:2020/vocab/resource/active-ingredient","dikbD2R:precipitant-drug-of-interaction","UNK","UNK","Oral","UNK","UNK","Oral","UNK","UNK","UNK","UNK","UNK","UNK","UNK","UNK","UNK","UNK","UNK","UNK","UNK","UNK"
"http://dbmi-icode-01.dbmi.pitt.edu:80/DDI-labels/51ff7db5-aaf9-4c3c-86e6-958ebf16b60f.html","2015-11-27 13:11:00 -0800","DDI-clinical-trial","evidence-supports","When alprazolam (1 mg BID) and nefazodone (200 mg BID) were coadministered, steady-state peak concentrations, AUC and half-life values for alprazolam increased by approximately 2 fold.","ncit:positive","ncit:quantitative","nefazodone","http://dbmi-icode-01.dbmi.pitt.edu:2020/vocab/resource/active-ingredient","dikbD2R:precipitant-drug-of-interaction","200","alprazolam","http://dbmi-icode-01.dbmi.pitt.edu:2020/vocab/resource/active-ingredient","dikbD2R:object-drug-of-interaction","1","BID","Oral","UNK","BID","Oral","UNK","UNK","2","Fold","Increase","UNK","UNK","UNK","2","Fold","Increase","2","Fold","Increase"
"http://dbmi-icode-01.dbmi.pitt.edu:80/DDI-labels/1a5a93be-7bc3-4714-9308-2fbfb8260e23.html","2016-02-29 17:07:32 -0500","drug-drug-interaction","evidence-supports","Concomitant administration of propranolol with phenothiazines results in increased plasma levels of both drugs.","ncit:positive","ncit:Qualitative","phenothiazines","http://dbmi-icode-01.dbmi.pitt.edu:2020/vocab/resource/active-ingredient","dikbD2R:precipitant-drug-of-interaction",,"propranolol","http://dbmi-icode-01.dbmi.pitt.edu:2020/vocab/resource/active-ingredient","dikbD2R:object-drug-of-interaction","nodeID://b35093",,,,,,,,,,,,,,,,,,,
"http://dbmi-icode-01.dbmi.pitt.edu:80/DDI-labels/9c4bedb4-2d59-4fcd-aad7-fce988cd96d8.html","2016-02-29 14:19:31 -0700","drug-drug-interaction","evidence-supports","Reduced cytochrome P450 2D6 isozyme activity drugs that inhibit this isozyme (e.g., fluoxetine and paroxetine) and certain other drugs (e.g., fluvoxamine, propranolol, and pindolol) appear to appreciably inhibit the metabolism of thioridazine. The resulting elevated levels of thioridazine would be expected to augment the prolongation of the QTc interval associated with thioridazine and may increase the risk of serious, potentially fatal, cardiac arrhythmias, such as Torsades de pointes type arrhythmias.","ncit:positive","ncit:Qualitative","thioridazine","http://dbmi-icode-01.dbmi.pitt.edu:2020/vocab/resource/active-ingredient","dikbD2R:object-drug-of-interaction","nodeID://b35888","fluoxetine","http://dbmi-icode-01.dbmi.pitt.edu:2020/vocab/resource/active-ingredient","dikbD2R:precipitant-drug-of-interaction",,,,,,,,,,,,,,,,,,,,
"http://dbmi-icode-01.dbmi.pitt.edu:80/DDI-labels/51ff7db5-aaf9-4c3c-86e6-958ebf16b60f.html","2015-11-27 14:04:35 -0800","DDI-clinical-trial","evidence-supports","With 5 mg BID doses of buspirone, slight increases in AUC were observed for nefazodone (23%) and its metabolites hydroxynefazodone (17%) and mCPP (9%).","ncit:positive","ncit:quantitative","buspirone","http://dbmi-icode-01.dbmi.pitt.edu:2020/vocab/resource/active-ingredient","dikbD2R:precipitant-drug-of-interaction","5","hydroxynefazodone","http://dbmi-icode-01.dbmi.pitt.edu:2020/vocab/resource/metabolite","dikbD2R:object-drug-of-interaction","250","BID","Oral","UNK","BID","Oral","UNK","UNK","17","Percent","Increase","UNK","UNK","UNK","UNK","UNK","UNK","UNK","UNK","UNK"
"http://dbmi-icode-01.dbmi.pitt.edu:80/DDI-labels/5f0c6f5f-b906-4c8f-8580-3939a476a1c1.html","2016-01-11 10:37:29 -0700","drug-drug-interaction","evidence-supports","Concomitant use of CLOZARIL and CYP1A2 inhibitors can increase plasma levels of clozapine, potentially resulting in adverse reactions. Reduce the CLOZARIL dose to one-third of the original dose when CLOZARIL is coadministered with strong CYP1A2 inhibitors (e.g., fluvoxamine, ciprofloxacin, or enoxacin). The CLOZARIL dose should be increased to the original dose when coadministration of strong CYP1A2 inhibitors is discontinued [see Dosage and Administration (2.6), Clinical Pharmacology (12.3)].","ncit:positive","ncit:Qualitative","clozapine","http://dbmi-icode-01.dbmi.pitt.edu:2020/vocab/resource/active-ingredient","dikbD2R:object-drug-of-interaction","nodeID://b34306","ciprofloxacin","http://dbmi-icode-01.dbmi.pitt.edu:2020/vocab/resource/active-ingredient","dikbD2R:precipitant-drug-of-interaction",,,,,,,,,,,,,,,,,,,,
"http://dbmi-icode-01.dbmi.pitt.edu:80/DDI-labels/d5051fbc-846b-4946-82df-341fb1216341.html","2016-02-16 13:28:51 -0700","DDI-clinical-trial","evidence-challenges","Single doses of olanzapine did not affect the pharmacokinetics of imipramine or its active metabolite desipramine.","ncit:negative","ncit:quantitative","imipramine","http://dbmi-icode-01.dbmi.pitt.edu:2020/vocab/resource/active-ingredient","dikbD2R:object-drug-of-interaction","UNK","olanzapine","http://dbmi-icode-01.dbmi.pitt.edu:2020/vocab/resource/active-ingredient","dikbD2R:precipitant-drug-of-interaction","UNK","UNK","Oral","UNK","SD","Oral","1","UNK","UNK","UNK","UNK","UNK","UNK","UNK","UNK","UNK","UNK","UNK","UNK","UNK"
"http://dbmi-icode-01.dbmi.pitt.edu:80/DDI-labels/d5051fbc-846b-4946-82df-341fb1216341.html","2016-02-16 12:34:19 -0700","DDI-clinical-trial","evidence-supports"," Carbamazepine therapy (200 mg bid) causes an approximately 50% increase in the clearance of olanzapine. ","ncit:positive","ncit:quantitative","Carbamazepine","http://dbmi-icode-01.dbmi.pitt.edu:2020/vocab/resource/active-ingredient","dikbD2R:precipitant-drug-of-interaction","200","olanzapine","http://dbmi-icode-01.dbmi.pitt.edu:2020/vocab/resource/active-ingredient","dikbD2R:object-drug-of-interaction","UNK","UNK","Oral","UNK","BID","Oral","UNK","UNK","UNK","UNK","UNK","50","Percent","Increase","UNK","UNK","UNK","UNK","UNK","UNK"
"http://dbmi-icode-01.dbmi.pitt.edu:80/DDI-labels/d5051fbc-846b-4946-82df-341fb1216341.html","2016-02-16 13:30:19 -0700","DDI-clinical-trial","evidence-challenges","Single doses of olanzapine did not affect the pharmacokinetics of imipramine or its active metabolite desipramine.","ncit:negative","ncit:quantitative","olanzapine","http://dbmi-icode-01.dbmi.pitt.edu:2020/vocab/resource/active-ingredient","dikbD2R:precipitant-drug-of-interaction","UNK","desipramine","http://dbmi-icode-01.dbmi.pitt.edu:2020/vocab/resource/metabolite","dikbD2R:object-drug-of-interaction","UNK","UNK","Oral","UNK","SD","Oral","1","UNK","UNKUNUNK","UNK","UNK","UNK","UNK","UNK","UNK","UNK","UNK","UNK","UNK","UNK"
"http://dbmi-icode-01.dbmi.pitt.edu:80/DDI-labels/51ff7db5-aaf9-4c3c-86e6-958ebf16b60f.html","2015-11-27 13:26:49 -0800","DDI-clinical-trial","evidence-challenges"," Pharmacodynamic effects of haloperidol were generally not altered significantly. There were no changes in the pharmacokinetic parameters for nefazodone","ncit:negative","ncit:quantitative","nefazodone","http://dbmi-icode-01.dbmi.pitt.edu:2020/vocab/resource/active-ingredient","dikbD2R:object-drug-of-interaction","200","haloperidol","http://dbmi-icode-01.dbmi.pitt.edu:2020/vocab/resource/active-ingredient","dikbD2R:precipitant-drug-of-interaction","5","BID","Oral","UNK","SD","Oral","1","UNK","UNK","UNK","UNK","UNK","UNK","UNK","UNK","UNK","UNK","UNK","UNK","UNK"
"http://dbmi-icode-01.dbmi.pitt.edu:80/DDI-labels/51ff7db5-aaf9-4c3c-86e6-958ebf16b60f.html","2015-11-29 12:20:54 -0800","drug-drug-interaction","evidence-supports","There have been reports of increased blood concentrations of cyclosporine and tacrolimus into toxic ranges when patients received these drugs concomitantly with nefazodone. Both cyclosporine and tacrolimus are substrates of CYP3A4, and nefazodone is known to inhibit this enzyme. If either cyclosporine or tacrolimus is administered with nefazodone, blood concentrations of the immunosuppressive agent should be monitored and dosage adjusted accordingly.","ncit:positive","ncit:Qualitative","cyclosporine","http://dbmi-icode-01.dbmi.pitt.edu:2020/vocab/resource/active-ingredient","dikbD2R:object-drug-of-interaction","nodeID://b36613","nefazodone","http://dbmi-icode-01.dbmi.pitt.edu:2020/vocab/resource/active-ingredient","dikbD2R:precipitant-drug-of-interaction",,,,,,,,,,,,,,,,,,,,
"http://dbmi-icode-01.dbmi.pitt.edu:80/DDI-labels/51ff7db5-aaf9-4c3c-86e6-958ebf16b60f.html","2015-11-29 12:14:12 -0800","drug-drug-interaction","evidence-supports","Lithium – In 13 healthy subjects the coadministration of nefazodone (200 mg BID) with lithium (500 mg BID) for 5 days (steady-state conditions) was found to be well tolerated. When the two drugs were coadministered, there were no changes in the steady-state pharmacokinetics of either lithium, nefazodone, or its metabolite HO-NEF; however, there were small decreases in the steady-state plasma concentrations of two nefazodone metabolites, mCPP and triazole-dione, which are considered not to be of clinical significance. Therefore, no dosage adjustment of either lithium or nefazodone is required when they are coadministered.","ncit:positive","ncit:Qualitative","mCPP","http://dbmi-icode-01.dbmi.pitt.edu:2020/vocab/resource/metabolite","dikbD2R:object-drug-of-interaction","nodeID://b33454","Lithium","http://dbmi-icode-01.dbmi.pitt.edu:2020/vocab/resource/active-ingredient","dikbD2R:precipitant-drug-of-interaction",,,,,,,,,,,,,,,,,,,,
"http://dbmi-icode-01.dbmi.pitt.edu:80/DDI-labels/49c4105b-e518-481c-a248-6684135f5bc1.html","2015-11-29 18:49:20 -0500","DDI-clinical-trial","evidence-challenges","Risperidone (0.25 mg twice daily) did not show a clinically relevant effect on the pharmacokinetics of digoxin. Dose adjustment for digoxin is not recommended.","ncit:negative","ncit:quantitative","digoxin","http://dbmi-icode-01.dbmi.pitt.edu:2020/vocab/resource/active-ingredient","dikbD2R:object-drug-of-interaction","UNK","Risperidone","http://dbmi-icode-01.dbmi.pitt.edu:2020/vocab/resource/active-ingredient","dikbD2R:precipitant-drug-of-interaction",".25","UNK","Oral","UNK","BID","Oral","UNK","UNK","UNK","UNK","UNK","UNK","UNK","UNK","UNK","UNK","UNK","UNK","UNK","UNK"
"http://dbmi-icode-01.dbmi.pitt.edu:80/DDI-labels/51ff7db5-aaf9-4c3c-86e6-958ebf16b60f.html","2015-11-27 12:58:57 -0800","DDI-clinical-trial","evidence-supports","Interaction studies of nefazodone with two triazolobenzodiazepines, i.e., triazolam and alprazolam, metabolized by cytochrome P450 3A4, have revealed substantial and clinically important increases in plasma concentrations of these compounds when administered concomitantly with nefazodone","ncit:positive","ncit:quantitative","alprazolam","http://dbmi-icode-01.dbmi.pitt.edu:2020/vocab/resource/active-ingredient","dikbD2R:object-drug-of-interaction","UNK","nefazodone","http://dbmi-icode-01.dbmi.pitt.edu:2020/vocab/resource/active-ingredient","dikbD2R:precipitant-drug-of-interaction","UNK","UNK","UNK","UNK","UNK","UNK","UNK","UNK","UNK","UNK","UNK","UNK","UNK","UNK","UNK","UNK","UNK","UNK","UNK","UNK"
"http://dbmi-icode-01.dbmi.pitt.edu:80/DDI-labels/51ff7db5-aaf9-4c3c-86e6-958ebf16b60f.html","2015-11-27 14:29:38 -0800","DDI-clinical-trial","evidence-challenges"," When fluoxetine (20 mg QD) and nefazodone (200 mg BID) were administered at steady state there were no changes in the pharmacokinetic parameters for fluoxetine or its metabolite, norfluoxetine. Similarly, there were no changes in the pharmacokinetic parameters of nefazodone or HO-NEF; however, the mean AUC levels of the nefazodone metabolites mCPP and triazole-dione increased by 3 to 6 fold and 1.3 fold, respectively","ncit:negative","ncit:quantitative","HO-NEF","http://dbmi-icode-01.dbmi.pitt.edu:2020/vocab/resource/metabolite","dikbD2R:object-drug-of-interaction","200","fluoxetine","http://dbmi-icode-01.dbmi.pitt.edu:2020/vocab/resource/active-ingredient","dikbD2R:precipitant-drug-of-interaction","20","BID","Oral","UNK","QD","Oral","UNK","UNK","UNK","UNK","UNK","UNK","UNK","UNK","UNK","UNK","UNK","UNK","UNK","UNK"
"http://dbmi-icode-01.dbmi.pitt.edu:80/DDI-labels/4e1e5249-1cb7-4cc2-ad5a-cdeeee2f494f.html","2016-02-16 16:45:41 -0700","drug-drug-interaction","evidence-supports","Quetiapine exposure is increased by the prototype CYP3A4 inhibitors (e.g., ketoconazole, itraconazole, indinavir, ritonavir, nefazodone, etc.). and decreased by the prototype CYP3A4 inducers (e..g, phenytoin, carbamazepine, rifampin, avasimibe, St. John’s wort etc.).","ncit:positive","ncit:Qualitative","carbamazepine","http://dbmi-icode-01.dbmi.pitt.edu:2020/vocab/resource/active-ingredient","dikbD2R:precipitant-drug-of-interaction",,"Quetiapine","http://dbmi-icode-01.dbmi.pitt.edu:2020/vocab/resource/active-ingredient","dikbD2R:object-drug-of-interaction","nodeID://b36259",,,,,,,,,,,,,,,,,,,
"http://dbmi-icode-01.dbmi.pitt.edu:80/DDI-labels/036db1f2-52b3-42a0-acf9-817b7ba8c724.html","2015-12-08 18:52:09 -0700","DDI-clinical-trial","evidence-challenges","Ziprasidone at a dose of 40 mg twice daily administered concomitantly with lithium at a dose of 450 mg twice daily for 7 days did not affect the steady-state level or renal clearance of lithium. Ziprasidone dosed adjunctively to lithium in a maintenance trial of bipolar patients did not affect mean therapeutic lithium levels.","ncit:negative","ncit:quantitative","Ziprasidone","http://dbmi-icode-01.dbmi.pitt.edu:2020/vocab/resource/active-ingredient","dikbD2R:precipitant-drug-of-interaction","40","lithium","http://dbmi-icode-01.dbmi.pitt.edu:2020/vocab/resource/active-ingredient","dikbD2R:object-drug-of-interaction","450","BID","Oral","7","BID","Oral","UNK","UNK","UNK","UNK","UNK","UNK","UNK","UNK","UNK","UNK","UNK","UNK","UNK","UNK"
